{
"type": "FeatureCollection",
"name": "loi",
"crs": { "type": "name", "properties": { "name": "urn:ogc:def:crs:OGC:1.3:CRS84" } },
"features": [
{ "type": "Feature", "properties": { "id": "a0l4a0000004Gax", "Event": "Chatters Laundromat Māngere 19/08/21", "Location": "5A Wanstead Way, Māngere, Auckland 2022", "City": "Auckland", "Start": "2021-08-19T14:19:00Z", "End": "2021-08-19T15:00:00Z", "Advice": "Isolate at home for 14 days from date of last exposure. Test immediately, and on days 5 & 12 after last exposure. Call Healthline for what to do next.", "Added": "22/08/2021 9:40", "lat": -36.970604, "lon": 174.802618 }, "geometry": { "type": "Point", "coordinates": [ 174.802618, -36.970604 ] } },
{ "type": "Feature", "properties": { "id": "a0l4a0000004Gai", "Event": "Countdown Manukau 19/08/21", "Location": "652 Great South Road, Manukau, Auckland 2104", "City": "Auckland", "Start": "2021-08-19T16:53:00Z", "End": "2021-08-19T17:30:00Z", "Advice": "Stay at home, test immediately and on or around day 5 after last exposure and continue to stay at home until you receive a negative day 5 test result. Call Healthline for what to do next.", "Added": "22/08/2021 9:40", "lat": -36.9872, "lon": 174.882 }, "geometry": { "type": "Point", "coordinates": [ 174.882, -36.9872 ] } },
{ "type": "Feature", "properties": { "id": "a0l4a0000004GhF", "Event": "Westside Fitness Henderson 11/08/21", "Location": "21 Catherine Street, Henderson, Auckland 0612", "City": "Auckland", "Start": "2021-08-11T17:30:00Z", "End": "2021-08-11T19:30:00Z", "Advice": "Isolate at home for 14 days from date of last exposure. Test immediately, and on days 5 & 12 after last exposure. Call Healthline for what to do next.", "Added": "2021-08-23 08:18:08", "lat": -36.883188, "lon": 174.632679 }, "geometry": { "type": "Point", "coordinates": [ 174.632679, -36.883188 ] } },
{ "type": "Feature", "properties": { "id": "a0l4a0000004Gb2", "Event": "Countdown Greenlane 17/08/21", "Location": "326 Great South Road, Greenlane, Auckland 1051", "City": "Auckland", "Start": "2021-08-17T20:27:00Z", "End": "2021-08-17T20:50:00Z", "Advice": "Isolate at home for 14 days from date of last exposure. Test immediately, and on days 5 & 12 after last exposure. Call Healthline for what to do next.", "Added": "22/08/2021 9:40", "lat": -36.88973, "lon": 174.793482 }, "geometry": { "type": "Point", "coordinates": [ 174.793482, -36.88973 ] } },
{ "type": "Feature", "properties": { "id": "a0l4a0000004GbC", "Event": "Lone Star Alexandra Park 17/08/21", "Location": "223D Green Lane West, Epsom, Auckland 1051", "City": "Auckland", "Start": "2021-08-17T18:38:00Z", "End": "2021-08-17T20:15:00Z", "Advice": "Isolate at home for 14 days from date of last exposure. Test immediately, and on days 5 & 12 after last exposure. Call Healthline for what to do next.", "Added": "2021-08-22 19:15:42", "lat": -36.892479, "lon": 174.778526 }, "geometry": { "type": "Point", "coordinates": [ 174.778526, -36.892479 ] } },
{ "type": "Feature", "properties": { "id": "a0l4a0000004GbR", "Event": "AUT City Campus 17/08/21", "Location": "55 Wellesley Street East, Auckland Central, Auckland 1010", "City": "Auckland", "Start": "2021-08-17T11:40:00Z", "End": "2021-08-17T17:00:00Z", "Advice": "All at AUT City Campus, Tech Central, WA4 11.40am-3pm or in Paper PSYC781, Lecture Theatre WG801/802 2-5pm Isolate at home for 14 days from date of last exposure. Test immediately, and on days 5 & 12 after last exposure.Call Healthline for what to do next", "Added": "2021-08-23 12:58:05", "lat": -36.852634, "lon": 174.766787 }, "geometry": { "type": "Point", "coordinates": [ 174.766787, -36.852634 ] } },
{ "type": "Feature", "properties": { "id": "a0l4a0000004GbX", "Event": "AUT North Campus 16/08/21", "Location": "90 Akoranga Drive, Northcote, Auckland 0627", "City": "Auckland", "Start": "2021-08-16T10:40:00Z", "End": "2021-08-16T16:00:00Z", "Advice": "All at AUT North Campus, AL computer lab 10.40am-3pm or in Paper PSYC706, Lecture Theatre AA234 2.10pm-4pm Isolate at home for 14 days from date of last exposure. Test immediately,and on days 5 & 12 after last exposure.Call Healthline for what to do next.", "Added": "2021-08-23 12:58:05", "lat": -36.797444, "lon": 174.755825 }, "geometry": { "type": "Point", "coordinates": [ 174.755825, -36.797444 ] } },
{ "type": "Feature", "properties": { "id": "a0l4a0000004GhU", "Event": "Liquor Zone Auckland CBD 13/08/2021", "Location": "9-15 Wakefield Street, Auckland CBD, Auckland 1010", "City": "Auckland", "Start": "2021-08-13T19:00:00Z", "End": "2021-08-13T20:00:00Z", "Advice": "Isolate at home for 14 days from date of last exposure. Test immediately, and on days 5 & 12 after last exposure. Call Healthline for what to do next.", "Added": "22/08/2021 9:40", "lat": -36.8531, "lon": 174.7643 }, "geometry": { "type": "Point", "coordinates": [ 174.7643, -36.8531 ] } },
{ "type": "Feature", "properties": { "id": "a0l4a0000004Gc0", "Event": "St Therese Catholic Church Māngere East 15/08/21", "Location": "10 Wickman Way, Māngere East, Auckland 2024", "City": "Auckland", "Start": "2021-08-15T18:00:00Z", "End": "2021-08-15T19:30:00Z", "Advice": "Isolate at home for 14 days from date of last exposure. Test immediately, and on days 5 & 12 after last exposure. Call Healthline for what to do next.", "Added": "2021-08-24 10:17:56", "lat": -36.963683, "lon": 174.814122 }, "geometry": { "type": "Point", "coordinates": [ 174.814122, -36.963683 ] } },
{ "type": "Feature", "properties": { "id": "a0l4a0000004G6n", "Event": "AUT City campus 11/8/2021", "Location": "55 Wellesley Street East, Auckland Central, Auckland 1010", "City": "Auckland", "Start": "2021-08-11T09:30:00Z", "End": "2021-08-11T20:30:00Z", "Advice": "All at 3-5pm WA220 COMP501/52 Computing Technology in Society and 5-8pm WG707/708 DIGD507/51 Mahi tahi will be sent information on isolation & testing by AUT. All elsewhere on city campus follow Level 4 instructions & call Healthline if symptomatic", "Added": "22/08/2021 9:40", "lat": -36.852634, "lon": 174.766787 }, "geometry": { "type": "Point", "coordinates": [ 174.766787, -36.852634 ] } },
{ "type": "Feature", "properties": { "id": "a0l4a0000004Gn3", "Event": "West City Mall Henderson 15/08/2021", "Location": "7 Catherine Street, Henderson, Auckland 0612", "City": "Auckland", "Start": "2021-08-15T13:00:00Z", "End": "2021-08-15T15:00:00Z", "Advice": "Stay at home, test immediately and on or around day 5 after last exposure and continue to stay at home until you receive a negative day 5 test result. Call Healthline for what to do next.", "Added": "2021-08-23 12:58:05", "lat": -36.882252, "lon": 174.63269 }, "geometry": { "type": "Point", "coordinates": [ 174.63269, -36.882252 ] } },
{ "type": "Feature", "properties": { "id": "a0l4a0000004FBd", "Event": "Icco Sake Bar Auckland 11/08/2021", "Location": "601 New North Road, Morningside, Auckland 1021", "City": "Auckland", "Start": "2021-08-11T11:30:00Z", "End": "2021-08-11T13:00:00Z", "Advice": "Isolate at home for 14 days from date of last exposure. Test immediately, and on days 5 & 12 after last exposure. Call Healthline for what to do next.", "Added": "", "lat": -36.873569, "lon": 174.736975 }, "geometry": { "type": "Point", "coordinates": [ 174.736975, -36.873569 ] } },
{ "type": "Feature", "properties": { "id": "a0l4a0000004HP2", "Event": "TAPAC The Auckland Performing Arts Centre Western Springs 13/08/2021", "Location": "100 Motions Road, Western Springs, Auckland 1022", "City": "Auckland", "Start": "2021-08-13T17:00:00Z", "End": "2021-08-13T18:00:00Z", "Advice": "Isolate at home for 14 days from date of last exposure. Test immediately, and on days 5 & 12 after last exposure. Call Healthline for what to do next.", "Added": "2021-08-23 12:58:05", "lat": -36.862032, "lon": 174.717832 }, "geometry": { "type": "Point", "coordinates": [ 174.717832, -36.862032 ] } },
{ "type": "Feature", "properties": { "id": "a0l4a0000004HPR", "Event": "Taco Bell Auckland CBD 10/08/2021", "Location": "3 Shortland Street, Auckland Central, Auckland 1010", "City": "Auckland", "Start": "2021-08-10T12:30:00Z", "End": "2021-08-10T13:00:00Z", "Advice": "Isolate at home for 14 days from date of last exposure. Test immediately, and on days 5 & 12 after last exposure. Call Healthline for what to do next.", "Added": "2021-08-23 10:20:44", "lat": -36.846572, "lon": 174.766421 }, "geometry": { "type": "Point", "coordinates": [ 174.766421, -36.846572 ] } },
{ "type": "Feature", "properties": { "id": "a0l4a0000004HPq", "Event": "McDonalds Auckland CBD 10/08/2021", "Location": "268 Queen Street, Auckland Central, Auckland 1010", "City": "Auckland", "Start": "2021-08-10T13:00:00Z", "End": "2021-08-10T14:00:00Z", "Advice": "Isolate at home for 14 days from date of last exposure. Test immediately, and on days 5 & 12 after last exposure. Call Healthline for what to do next.", "Added": "2021-08-23 10:20:44", "lat": -36.851115, "lon": 174.764041 }, "geometry": { "type": "Point", "coordinates": [ 174.764041, -36.851115 ] } },
{ "type": "Feature", "properties": { "id": "a0l4a0000004HQ0", "Event": "McDonalds New Lynn 10/08/2021", "Location": "1 Memorial Drive, New Lynn, Auckland 0600", "City": "Auckland", "Start": "2021-08-10T15:00:00Z", "End": "2021-08-10T15:30:00Z", "Advice": "Isolate at home for 14 days from date of last exposure. Test immediately, and on days 5 & 12 after last exposure. Call Healthline for what to do next.", "Added": "2021-08-23 10:20:44", "lat": -36.908262, "lon": 174.68357 }, "geometry": { "type": "Point", "coordinates": [ 174.68357, -36.908262 ] } },
{ "type": "Feature", "properties": { "id": "a0l4a0000004HQK", "Event": "Lynn Mall Shopping Centre New Lynn 10/08/2021", "Location": "3058 Great North Road, New Lynn, Auckland 0600", "City": "Auckland", "Start": "2021-08-10T15:00:00Z", "End": "2021-08-10T18:00:00Z", "Advice": "Isolate at home for 14 days from date of last exposure. Test immediately, and on days 5 & 12 after last exposure. Call Healthline for what to do next.", "Added": "2021-08-23 10:20:44", "lat": -36.906516, "lon": 174.68499 }, "geometry": { "type": "Point", "coordinates": [ 174.68499, -36.906516 ] } },
{ "type": "Feature", "properties": { "id": "a0l4a0000004HPH", "Event": "Charmate Restaurant Auckland CBD 10/08/2021", "Location": "17 Swanson Street, Auckland Central, Auckland 1010", "City": "Auckland", "Start": "2021-08-10T11:45:00Z", "End": "2021-08-10T12:15:00Z", "Advice": "Isolate at home for 14 days from date of last exposure. Test immediately, and on days 5 & 12 after last exposure. Call Healthline for what to do next.", "Added": "2021-08-23 12:58:05", "lat": -36.845796, "lon": 174.764469 }, "geometry": { "type": "Point", "coordinates": [ 174.764469, -36.845796 ] } },
{ "type": "Feature", "properties": { "id": "a0l4a0000004HPW", "Event": "Starbucks Auckland CBD 10/08/2021", "Location": "220 Queen Street, Auckland Central, Auckland 1010", "City": "Auckland", "Start": "2021-08-10T12:45:00Z", "End": "2021-08-10T13:30:00Z", "Advice": "Isolate at home for 14 days from date of last exposure. Test immediately, and on days 5 & 12 after last exposure. Call Healthline for what to do next.", "Added": "2021-08-23 10:20:44", "lat": -36.849304, "lon": 174.765469 }, "geometry": { "type": "Point", "coordinates": [ 174.765469, -36.849304 ] } },
{ "type": "Feature", "properties": { "id": "a0l4a0000004GcK", "Event": "Wymondley Early Learning Centre Ōtara 17/08/2021", "Location": "77s Wymondley Road, Ōtara, Auckland 2025", "City": "Auckland", "Start": "2021-08-17T08:50:00Z", "End": "2021-08-17T09:10:00Z", "Advice": "Isolate at home for 14 days from date of last exposure. Test immediately, and on days 5 & 12 after last exposure. Call Healthline for what to do next.", "Added": "22/08/2021 11:49", "lat": -36.951, "lon": 174.8565 }, "geometry": { "type": "Point", "coordinates": [ 174.8565, -36.951 ] } },
{ "type": "Feature", "properties": { "id": "a0l4a0000004Gd3", "Event": "Wymondley Road Superette Ōtara 17/08/2021", "Location": "2 Wymondley Road, Ōtara, Auckland 2025", "City": "Auckland", "Start": "2021-08-17T19:40:00Z", "End": "2021-08-17T19:45:00Z", "Advice": "Isolate at home for 14 days from date of last exposure. Test immediately, and on days 5 & 12 after last exposure. Call Healthline for what to do next.", "Added": "22/08/2021 9:40", "lat": -36.95756, "lon": 174.859472 }, "geometry": { "type": "Point", "coordinates": [ 174.859472, -36.95756 ] } },
{ "type": "Feature", "properties": { "id": "a0l4a0000004Gdr", "Event": "McDonald's Manukau 17/08/2021", "Location": "2 Ronwood Avenue, Manukau, Auckland 2104", "City": "Auckland", "Start": "2021-08-17T18:30:00Z", "End": "2021-08-17T19:15:00Z", "Advice": "Isolate at home for 14 days from date of last exposure. Test immediately, and on days 5 & 12 after last exposure. Call Healthline for what to do next.", "Added": "22/08/2021 9:40", "lat": -36.989633, "lon": 174.880198 }, "geometry": { "type": "Point", "coordinates": [ 174.880198, -36.989633 ] } },
{ "type": "Feature", "properties": { "id": "a0l4a0000004H7m", "Event": "Koffee Bar West City Henderson 15/08/2021", "Location": "7 Catherine Street, Henderson, Auckland 0612", "City": "Auckland", "Start": "2021-08-15T13:00:00Z", "End": "2021-08-15T15:00:00Z", "Advice": "Isolate at home for 14 days from date of last exposure. Test immediately, and on days 5 & 12 after last exposure. Call Healthline for what to do next.", "Added": "2021-08-22 17:16:00", "lat": -36.882252, "lon": 174.63269 }, "geometry": { "type": "Point", "coordinates": [ 174.63269, -36.882252 ] } },
{ "type": "Feature", "properties": { "id": "a0l4a0000004Gco", "Event": "Seaworld Fisheries Ōtara 20/08/2021", "Location": "122 East Tamaki Road, Ōtara, Manukau 2023", "City": "Manukau", "Start": "2021-08-20T10:50:00Z", "End": "2021-08-20T10:55:00Z", "Advice": "Isolate at home for 14 days from date of last exposure. Test immediately, and on days 5 & 12 after last exposure. Call Healthline for what to do next.", "Added": "22/08/2021 9:40", "lat": -36.9616, "lon": 174.874 }, "geometry": { "type": "Point", "coordinates": [ 174.874, -36.9616 ] } },
{ "type": "Feature", "properties": { "id": "a0l4a0000004GdD", "Event": "Countdown Takanini 19/08/2021", "Location": "228 Great South Road, Takanini, Takanini 2112", "City": "Takanini", "Start": "2021-08-19T07:00:00Z", "End": "2021-08-19T07:10:00Z", "Advice": "Stay at home, test immediately and on or around day 5 after last exposure and continue to stay at home until you receive a negative day 5 test result. Call Healthline for what to do next.", "Added": "2021-08-22 19:15:42", "lat": -37.048739, "lon": 174.927509 }, "geometry": { "type": "Point", "coordinates": [ 174.927509, -37.048739 ] } },
{ "type": "Feature", "properties": { "id": "a0l4a0000004H7w", "Event": "Soymate Sushi West City Henderson 15/08/2021", "Location": "7 Catherine Street, Henderson, Auckland 0612", "City": "Auckland", "Start": "2021-08-15T13:00:00Z", "End": "2021-08-15T15:00:00Z", "Advice": "Isolate at home for 14 days from date of last exposure. Test immediately, and on days 5 & 12 after last exposure. Call Healthline for what to do next.", "Added": "2021-08-22 19:15:42", "lat": -36.882252, "lon": 174.63269 }, "geometry": { "type": "Point", "coordinates": [ 174.63269, -36.882252 ] } },
{ "type": "Feature", "properties": { "id": "a0l4a0000004Gdh", "Event": "Countdown Takanini 16/08/2021", "Location": "228 Great South Road, Takanini, Auckland 2112", "City": "Auckland", "Start": "2021-08-16T10:00:00Z", "End": "2021-08-16T10:10:00Z", "Advice": "Isolate at home for 14 days from date of last exposure. Test immediately, and on days 5 & 12 after last exposure. Call Healthline for what to do next.", "Added": "2021-08-23 08:18:08", "lat": -37.048739, "lon": 174.927509 }, "geometry": { "type": "Point", "coordinates": [ 174.927509, -37.048739 ] } },
{ "type": "Feature", "properties": { "id": "a0l4a0000004H8p", "Event": "Level 3 Library AUT City Campus 17/08/2021", "Location": "55 Wellesley Street East, Auckland Central, Auckland 1010", "City": "Auckland", "Start": "2021-08-17T10:45:00Z", "End": "2021-08-17T19:15:00Z", "Advice": "Isolate at home for 14 days from date of last exposure. Test immediately, and on days 5 & 12 after last exposure. Call Healthline for what to do next.", "Added": "2021-08-24 14:14:30", "lat": -36.852634, "lon": 174.766787 }, "geometry": { "type": "Point", "coordinates": [ 174.766787, -36.852634 ] } },
{ "type": "Feature", "properties": { "id": "a0l4a0000004H9E", "Event": "AUT Library Level 3 City Campus 16/08/2021", "Location": "55 Wellesley Street East, Auckland Central, Auckland 1010", "City": "Auckland", "Start": "2021-08-16T10:15:00Z", "End": "2021-08-16T17:00:00Z", "Advice": "Isolate at home for 14 days from date of last exposure. Test immediately, and on days 5 & 12 after last exposure. Call Healthline for what to do next.", "Added": "2021-08-24 14:14:30", "lat": -36.852634, "lon": 174.766787 }, "geometry": { "type": "Point", "coordinates": [ 174.766787, -36.852634 ] } },
{ "type": "Feature", "properties": { "id": "a0l4a0000004H9i", "Event": "Dotti Westfield Albany 13/08/2021", "Location": "219 Don McKinnon Drive, Albany, Auckland 0632", "City": "Auckland", "Start": "2021-08-13T18:00:00Z", "End": "2021-08-13T21:45:00Z", "Advice": "Isolate at home for 14 days from date of last exposure. Test immediately, and on days 5 & 12 after last exposure. Call Healthline for what to do next.", "Added": "2021-08-24 14:14:30", "lat": -36.7281, "lon": 174.7097 }, "geometry": { "type": "Point", "coordinates": [ 174.7097, -36.7281 ] } },
{ "type": "Feature", "properties": { "id": "a0l4a0000004HAC", "Event": "Revive Vegan Cafe Auckland CBD 13/08/2021", "Location": "33 Lorne Street, Auckland CBD, Auckland 1010", "City": "Auckland", "Start": "2021-08-13T14:30:00Z", "End": "2021-08-13T15:37:00Z", "Advice": "Stay at home, test immediately and on or around day 5 after last exposure and continue to stay at home until you receive a negative day 5 test result. Call Healthline for what to do next.", "Added": "2021-08-23 20:24:27", "lat": -36.8506, "lon": 174.7654 }, "geometry": { "type": "Point", "coordinates": [ 174.7654, -36.8506 ] } },
{ "type": "Feature", "properties": { "id": "a0l4a0000004H8q", "Event": "Dotti Westfield Albany 15/08/2021", "Location": "219 Don McKinnon Drive, Albany, Auckland 0632", "City": "Auckland", "Start": "2021-08-15T10:00:00Z", "End": "2021-08-15T18:30:00Z", "Advice": "Isolate at home for 14 days from date of last exposure. Test immediately, and on days 5 & 12 after last exposure. Call Healthline for what to do next.", "Added": "2021-08-24 14:14:30", "lat": -36.7281, "lon": 174.7097 }, "geometry": { "type": "Point", "coordinates": [ 174.7097, -36.7281 ] } },
{ "type": "Feature", "properties": { "id": "a0l4a0000004HA7", "Event": "Auckland Art Gallery Auckland CBD 13/08/2021", "Location": "Wellesley Street East, Auckland CBD, Auckland 1010", "City": "Auckland", "Start": "2021-08-13T14:45:00Z", "End": "2021-08-13T17:45:00Z", "Advice": "Isolate at home for 14 days from date of last exposure. Test immediately, and on days 5 & 12 after last exposure. Call Healthline for what to do next.", "Added": "2021-08-23 20:24:27", "lat": -36.8513, "lon": 174.7662 }, "geometry": { "type": "Point", "coordinates": [ 174.7662, -36.8513 ] } },
{ "type": "Feature", "properties": { "id": "a0l4a0000004H9x", "Event": "Level 3 Library AUT City Campus 13/08/2021", "Location": "55 Wellesley Street East, Auckland CBD, Auckland 1010", "City": "Auckland", "Start": "2021-08-13T16:45:00Z", "End": "2021-08-13T17:05:00Z", "Advice": "Isolate at home for 14 days from date of last exposure. Test immediately, and on days 5 & 12 after last exposure. Call Healthline for what to do next.", "Added": "2021-08-24 14:14:30", "lat": -36.8533, "lon": 174.7674 }, "geometry": { "type": "Point", "coordinates": [ 174.7674, -36.8533 ] } },
{ "type": "Feature", "properties": { "id": "a0l4a0000004HAb", "Event": "Portmans Shore City Mall Takapuna 12/08/2021", "Location": "52-56 Anzac Street, Takapuna, Auckland 0622", "City": "Auckland", "Start": "2021-08-12T18:00:00Z", "End": "2021-08-12T22:00:00Z", "Advice": "Isolate at home for 14 days from date of last exposure. Test immediately, and on days 5 & 12 after last exposure. Call Healthline for what to do next.", "Added": "2021-08-23 20:24:27", "lat": -36.7878, "lon": 174.77 }, "geometry": { "type": "Point", "coordinates": [ 174.77, -36.7878 ] } },
{ "type": "Feature", "properties": { "id": "a0l4a0000004HB5", "Event": "Browns St Heliers Mall Cafe 14/08/21", "Location": "33-39 Saint Heliers Bay Road, St Heliers, Auckland 1071", "City": "Auckland", "Start": "2021-08-14T10:00:00Z", "End": "2021-08-14T11:00:00Z", "Advice": "Isolate at home for 14 days from date of last exposure. Test immediately, and on days 5 & 12 after last exposure. Call Healthline for what to do next.", "Added": "2021-08-23 18:42:37", "lat": -36.8511, "lon": 174.8576 }, "geometry": { "type": "Point", "coordinates": [ 174.8576, -36.8511 ] } },
{ "type": "Feature", "properties": { "id": "a0l4a0000004HAR", "Event": "Level 3 Library AUT City Campus 13/08/2021", "Location": "55 Wellesley Street East, Auckland CBD, Auckland 1010", "City": "Auckland", "Start": "2021-08-13T11:00:00Z", "End": "2021-08-13T14:30:00Z", "Advice": "Isolate at home for 14 days from date of last exposure. Test immediately, and on days 5 & 12 after last exposure. Call Healthline for what to do next.", "Added": "2021-08-24 14:14:30", "lat": -36.8533, "lon": 174.7674 }, "geometry": { "type": "Point", "coordinates": [ 174.7674, -36.8533 ] } },
{ "type": "Feature", "properties": { "id": "a0l4a0000004HBK", "Event": "St Patricks Cathedral Auckland CBD 12/08/2021", "Location": "43 Wyndham Street, Auckland CBD, Auckland 1010", "City": "Auckland", "Start": "2021-08-12T12:15:00Z", "End": "2021-08-12T13:15:00Z", "Advice": "Isolate at home for 14 days from date of last exposure. Test immediately, and on days 5 & 12 after last exposure. Call Healthline for what to do next.", "Added": "2021-08-23 18:42:37", "lat": -36.8464, "lon": 174.7634 }, "geometry": { "type": "Point", "coordinates": [ 174.7634, -36.8464 ] } },
{ "type": "Feature", "properties": { "id": "a0l4a0000004HAg", "Event": "Commercial Bay Mall, CBD 12/08/2021", "Location": "7 Queen Street, Auckland CBD, Auckland 1010", "City": "Auckland", "Start": "2021-08-12T13:45:00Z", "End": "2021-08-12T14:30:00Z", "Advice": "Isolate at home for 14 days from date of last exposure. Test immediately, and on days 5 & 12 after last exposure. Call Healthline for what to do next.", "Added": "2021-08-23 20:24:27", "lat": -36.844, "lon": 174.7661 }, "geometry": { "type": "Point", "coordinates": [ 174.7661, -36.844 ] } },
{ "type": "Feature", "properties": { "id": "a0l4a0000004HBo", "Event": "Level 3 Library AUT City Campus 11/08/2021", "Location": "55 Wellesley Street East, Auckland Central, Auckland 1010", "City": "Auckland", "Start": "2021-08-11T10:15:00Z", "End": "2021-08-11T14:45:00Z", "Advice": "Isolate at home for 14 days from date of last exposure. Test immediately, and on days 5 & 12 after last exposure. Call Healthline for what to do next.", "Added": "2021-08-24 14:14:30", "lat": -36.852634, "lon": 174.766787 }, "geometry": { "type": "Point", "coordinates": [ 174.766787, -36.852634 ] } },
{ "type": "Feature", "properties": { "id": "a0l4a0000004G6T", "Event": "Won Sushi Donburi 12/8/2021", "Location": "290 Queen Street, Auckland Central, Auckland 1010", "City": "Auckland", "Start": "2021-08-12T12:00:00Z", "End": "2021-08-12T13:00:00Z", "Advice": "Isolate at home for 14 days from date of last exposure. Test immediately, and on days 5 & 12 after last exposure. Call Healthline for what to do next.", "Added": "", "lat": -36.850691, "lon": 174.764852 }, "geometry": { "type": "Point", "coordinates": [ 174.764852, -36.850691 ] } },
{ "type": "Feature", "properties": { "id": "a0l4a0000004G4c", "Event": "F45 Training Papatoetoe 13/8/2021", "Location": "2/129 Great South Road, Papatoetoe, Auckland 2025", "City": "Auckland", "Start": "2021-08-13T05:00:00Z", "End": "2021-08-13T06:30:00Z", "Advice": "Isolate at home for 14 days from date of last exposure. Test immediately, and on days 5 & 12 after last exposure. Call Healthline for what to do next.", "Added": "", "lat": -36.968729, "lon": 174.859629 }, "geometry": { "type": "Point", "coordinates": [ 174.859629, -36.968729 ] } },
{ "type": "Feature", "properties": { "id": "a0l4a0000004GgC", "Event": "Hong Kong Bakery Māngere Bridge 16/08/2021", "Location": "28 Coronation Road, Māngere Bridge, Auckland 2022", "City": "Auckland", "Start": "2021-08-16T09:20:00Z", "End": "2021-08-16T09:45:00Z", "Advice": "Isolate at home for 14 days from date of last exposure. Test immediately, and on days 5 & 12 after last exposure. Call Healthline for what to do next.", "Added": "22/08/2021 9:40", "lat": -36.941765, "lon": 174.78678 }, "geometry": { "type": "Point", "coordinates": [ 174.78678, -36.941765 ] } },
{ "type": "Feature", "properties": { "id": "a0l4a0000004GfE", "Event": "Dentist Ōtara 17/08/2021", "Location": "3 Watford Street, Ōtara, Auckland 2023", "City": "Auckland", "Start": "2021-08-17T09:45:00Z", "End": "2021-08-17T11:45:00Z", "Advice": "Isolate at home for 14 days from date of last exposure. Test immediately, and on days 5 & 12 after last exposure. Call Healthline for what to do next.", "Added": "2021-08-23 18:42:37", "lat": -36.962111, "lon": 174.872911 }, "geometry": { "type": "Point", "coordinates": [ 174.872911, -36.962111 ] } },
{ "type": "Feature", "properties": { "id": "a0l4a0000004HAd", "Event": "Farro Fresh North Shore 12/08/2021", "Location": "Cnr Constellation Drive And Parkway Drive, Mairangi Bay, Auckland 0632", "City": "Auckland", "Start": "2021-08-12T10:20:00Z", "End": "2021-08-12T10:40:00Z", "Advice": "Isolate at home for 14 days from date of last exposure. Test immediately, and on days 5 & 12 after last exposure. Call Healthline for what to do next.", "Added": "2021-08-24 14:14:30", "lat": -36.7504, "lon": 174.7283 }, "geometry": { "type": "Point", "coordinates": [ 174.7283, -36.7504 ] } },
{ "type": "Feature", "properties": { "id": "a0l4a0000004HKH", "Event": "Green Bay High School 17/08/2021", "Location": "143 - 161 Godley Road, Green Bay, Auckland", "City": "Auckland", "Start": "2021-08-17T08:15:00Z", "End": "2021-08-17T15:30:00Z", "Advice": "Isolate at home for 14 days from date of last exposure. Test immediately, and on days 5 & 12 after last exposure. Call Healthline for what to do next.", "Added": "2021-08-23 20:24:27", "lat": -36.9313, "lon": 174.67 }, "geometry": { "type": "Point", "coordinates": [ 174.67, -36.9313 ] } },
{ "type": "Feature", "properties": { "id": "a0l4a0000004HDf", "Event": "The Warehouse Clendon 17/08/21", "Location": "Cnr Roscommon & Palmer Road, Clendon Park, Auckland", "City": "Auckland", "Start": "2021-08-17T09:00:00Z", "End": "2021-08-17T11:00:00Z", "Advice": "Isolate at home for 14 days from date of last exposure. Test immediately, and on days 5 & 12 after last exposure. Call Healthline for what to do next.", "Added": "2021-08-22 19:15:42", "lat": -37.0331, "lon": 174.8689 }, "geometry": { "type": "Point", "coordinates": [ 174.8689, -37.0331 ] } },
{ "type": "Feature", "properties": { "id": "a0l4a0000004HDk", "Event": "Moretons Bar & Restaurant St Heliers 16/08/2021", "Location": "425 Tamaki Drive, St Heliers, Auckland 1071", "City": "Auckland", "Start": "2021-08-16T17:45:00Z", "End": "2021-08-16T20:00:00Z", "Advice": "Isolate at home for 14 days from date of last exposure. Test immediately, and on days 5 & 12 after last exposure. Call Healthline for what to do next.", "Added": "2021-08-23 18:42:37", "lat": -36.850188, "lon": 174.858045 }, "geometry": { "type": "Point", "coordinates": [ 174.858045, -36.850188 ] } },
{ "type": "Feature", "properties": { "id": "a0l4a0000004HBy", "Event": "McDonald's Wairau Valley 10/08/2021", "Location": "142 Wairau Road, Wairau Valley, Auckland 0627", "City": "Auckland", "Start": "2021-08-10T21:35:00Z", "End": "2021-08-10T21:40:00Z", "Advice": "Self-monitor for COVID-19 symptoms for 14 days. If symptoms develop, get a test and stay at home until you get a negative test result AND until 24 hours after symptoms resolve.", "Added": "2021-08-23 20:24:27", "lat": -36.772126, "lon": 174.740275 }, "geometry": { "type": "Point", "coordinates": [ 174.740275, -36.772126 ] } },
{ "type": "Feature", "properties": { "id": "a0l4a0000004HDz", "Event": "Food Village Manurewa 12/08/21", "Location": "235 Browns Road, Manurewa, Auckland 2102", "City": "Auckland", "Start": "2021-08-12T10:00:00Z", "End": "2021-08-12T10:15:00Z", "Advice": "Isolate at home for 14 days from date of last exposure. Test immediately, and on days 5 & 12 after last exposure. Call Healthline for what to do next.", "Added": "2021-08-23 08:18:08", "lat": -37.018233, "lon": 174.863558 }, "geometry": { "type": "Point", "coordinates": [ 174.863558, -37.018233 ] } },
{ "type": "Feature", "properties": { "id": "a0l4a0000004HGK", "Event": "New World Southmall Manurewa 21/08/2021", "Location": "185 Great South Road, Manurewa, Auckland 2102", "City": "Auckland", "Start": "2021-08-21T15:00:00Z", "End": "2021-08-21T15:15:00Z", "Advice": "Stay at home, test immediately and on or around day 5 after last exposure and continue to stay at home until you receive a negative day 5 test result. Call Healthline for what to do next.", "Added": "2021-08-23 20:24:27", "lat": -37.022389, "lon": 174.897106 }, "geometry": { "type": "Point", "coordinates": [ 174.897106, -37.022389 ] } },
{ "type": "Feature", "properties": { "id": "a0l4a0000004HF2", "Event": "Burger Fuel Mission Bay 14/08/2021", "Location": "61 Tamaki Drive, Mission Bay, Auckland 1071", "City": "Auckland", "Start": "2021-08-14T17:00:00Z", "End": "2021-08-14T17:15:00Z", "Advice": "Isolate at home for 14 days from date of last exposure. Test immediately, and on days 5 & 12 after last exposure. Call Healthline for what to do next.", "Added": "2021-08-23 18:42:37", "lat": -36.84835, "lon": 174.831245 }, "geometry": { "type": "Point", "coordinates": [ 174.831245, -36.84835 ] } },
{ "type": "Feature", "properties": { "id": "a0l4a0000004HIB", "Event": "Taste of Samoa Henderson 16/08/21", "Location": "3/24 Henderson Valley Road, Henderson, Auckland 0612", "City": "Auckland", "Start": "2021-08-16T11:00:00Z", "End": "2021-08-16T13:00:00Z", "Advice": "Isolate at home for 14 days from date of last exposure. Test immediately, and on days 5 & 12 after last exposure. Call Healthline for what to do next.", "Added": "2021-08-22 19:15:42", "lat": -36.88333, "lon": 174.629395 }, "geometry": { "type": "Point", "coordinates": [ 174.629395, -36.88333 ] } },
{ "type": "Feature", "properties": { "id": "a0l4a0000004HIG", "Event": "Countdown Westgate Shopping Centre Massey 16/08/21", "Location": "Cnr Westgate &, Fernhill Drive, Massey, Auckland 0614", "City": "Auckland", "Start": "2021-08-16T17:00:00Z", "End": "2021-08-16T18:00:00Z", "Advice": "Isolate at home for 14 days from date of last exposure. Test immediately, and on days 5 & 12 after last exposure. Call Healthline for what to do next.", "Added": "2021-08-22 19:15:42", "lat": -36.8209, "lon": 174.6143 }, "geometry": { "type": "Point", "coordinates": [ 174.6143, -36.8209 ] } },
{ "type": "Feature", "properties": { "id": "a0l4a0000004HKW", "Event": "Green Bay High School 12/08/2021", "Location": "143 - 161 Godley Road, Green Bay, Auckland", "City": "Auckland", "Start": "2021-08-12T08:15:00Z", "End": "2021-08-12T15:30:00Z", "Advice": "Isolate at home for 14 days from date of last exposure. Test immediately, and on days 5 & 12 after last exposure. Call Healthline for what to do next.", "Added": "2021-08-23 20:24:27", "lat": -36.9313, "lon": 174.67 }, "geometry": { "type": "Point", "coordinates": [ 174.67, -36.9313 ] } },
{ "type": "Feature", "properties": { "id": "a0l4a0000004HL0", "Event": "The Warehouse West City Waitakere 13/8/21", "Location": "7 Catherine Street, Henderson, Auckland 0612", "City": "Auckland", "Start": "2021-08-13T18:45:00Z", "End": "2021-08-13T20:30:00Z", "Advice": "Isolate at home for 14 days from date of last exposure. Test immediately, and on days 5 & 12 after last exposure. Call Healthline for what to do next.", "Added": "2021-08-23 20:24:27", "lat": -36.882252, "lon": 174.63269 }, "geometry": { "type": "Point", "coordinates": [ 174.63269, -36.882252 ] } },
{ "type": "Feature", "properties": { "id": "a0l4a0000004HLF", "Event": "Tank West City Waitakere 13/8/21", "Location": "7 Catherine Street, Henderson, Auckland 0612", "City": "Auckland", "Start": "2021-08-13T18:45:00Z", "End": "2021-08-13T20:30:00Z", "Advice": "Stay at home, test immediately and on or around day 5 after last exposure and continue to stay at home until you receive a negative day 5 test result. Call Healthline for what to do next.", "Added": "2021-08-23 20:24:27", "lat": -36.882252, "lon": 174.63269 }, "geometry": { "type": "Point", "coordinates": [ 174.63269, -36.882252 ] } },
{ "type": "Feature", "properties": { "id": "a0l4a0000004FpX", "Event": "Western Indoor Bowling Assn Inc New Lynn 17/08/2021", "Location": "38 Portage Road, New Lynn, Auckland 0600", "City": "Auckland", "Start": "2021-08-17T11:00:00Z", "End": "2021-08-17T15:00:00Z", "Advice": "Isolate at home for 14 days from date of last exposure. Test immediately, and on days 5 & 12 after last exposure. Call Healthline for what to do next.", "Added": "", "lat": -36.9097, "lon": 174.6898 }, "geometry": { "type": "Point", "coordinates": [ 174.6898, -36.9097 ] } },
{ "type": "Feature", "properties": { "id": "a0l4a0000004Fq1", "Event": "Giga Net Cafe 15/08/2021", "Location": "L2 65 Wakefield St, Auckland CBD, Auckland 1010", "City": "Auckland", "Start": "2021-08-15T14:00:00Z", "End": "2021-08-15T16:00:00Z", "Advice": "Isolate at home for 14 days from date of last exposure. Test immediately, and on days 5 & 12 after last exposure. Call Healthline for what to do next.", "Added": "", "lat": -36.8546, "lon": 174.7653 }, "geometry": { "type": "Point", "coordinates": [ 174.7653, -36.8546 ] } },
{ "type": "Feature", "properties": { "id": "a0l4a0000004GEN", "Event": "Gangnam Style Korean BBQ Buffet Manakau Auckland 14/8/21", "Location": "726 Great South Road, Manukau, Auckland 2104", "City": "Auckland", "Start": "2021-08-14T19:15:00Z", "End": "2021-08-14T20:45:00Z", "Advice": "Isolate at home for 14 days from date of last exposure. Test immediately, and on days 5 & 12 after last exposure. Call Healthline for what to do next.", "Added": "", "lat": -36.993229, "lon": 174.885927 }, "geometry": { "type": "Point", "coordinates": [ 174.885927, -36.993229 ] } },
{ "type": "Feature", "properties": { "id": "a0l4a0000004GJX", "Event": "Pinati's Keke Pua'a Queen St Ōtāhuhu Auckland 16/8/21", "Location": "19A Queen Street, Ōtāhuhu, Auckland 1062", "City": "Auckland", "Start": "2021-08-16T09:45:00Z", "End": "2021-08-16T10:45:00Z", "Advice": "Isolate at home for 14 days from date of last exposure. Test immediately, and on days 5 & 12 after last exposure. Call Healthline for what to do next.", "Added": "22/08/2021 9:40", "lat": -36.9457, "lon": 174.843722 }, "geometry": { "type": "Point", "coordinates": [ 174.843722, -36.9457 ] } },
{ "type": "Feature", "properties": { "id": "a0l4a0000004GK1", "Event": "BP Tokoroa 16/8/21", "Location": "32 Main Road, Tokoroa 3420", "City": "Tokoroa", "Start": "2021-08-16T15:00:00Z", "End": "2021-08-16T16:00:00Z", "Advice": "Isolate at home for 14 days from date of last exposure. Test immediately, and on days 5 & 12 after last exposure. Call Healthline for what to do next.", "Added": "22/08/2021 9:40", "lat": -38.215583, "lon": 175.87189 }, "geometry": { "type": "Point", "coordinates": [ 175.87189, -38.215583 ] } },
{ "type": "Feature", "properties": { "id": "a0l4a0000004Gh0", "Event": "CityFitness Henderson 11/08/21", "Location": "5 Vitasovich Avenue, Henderson, Auckland 0612", "City": "Auckland", "Start": "2021-08-11T16:00:00Z", "End": "2021-08-11T17:00:00Z", "Advice": "Isolate at home for 14 days from date of last exposure. Test immediately, and on days 5 & 12 after last exposure. Call Healthline for what to do next.", "Added": "22/08/2021 9:40", "lat": -36.882243, "lon": 174.634578 }, "geometry": { "type": "Point", "coordinates": [ 174.634578, -36.882243 ] } },
{ "type": "Feature", "properties": { "id": "a0l4a0000004HKg", "Event": "Green Bay High School 09/08/2021", "Location": "143-166 Godley Road, Green Bay, Auckland 0604", "City": "Auckland", "Start": "2021-08-09T08:15:00Z", "End": "2021-08-09T15:30:00Z", "Advice": "Isolate at home for 14 days from date of last exposure. Test immediately, and on days 5 & 12 after last exposure. Call Healthline for what to do next.", "Added": "2021-08-23 20:24:27", "lat": -36.9313, "lon": 174.67 }, "geometry": { "type": "Point", "coordinates": [ 174.67, -36.9313 ] } },
{ "type": "Feature", "properties": { "id": "a0l4a0000004HKM", "Event": "Green Bay High School 16/08/2021", "Location": "143 - 161 Godley Road, Green Bay, Auckland", "City": "Auckland", "Start": "2021-08-16T08:15:00Z", "End": "2021-08-16T15:30:00Z", "Advice": "Isolate at home for 14 days from date of last exposure. Test immediately, and on days 5 & 12 after last exposure. Call Healthline for what to do next.", "Added": "2021-08-23 20:24:27", "lat": -36.9313, "lon": 174.67 }, "geometry": { "type": "Point", "coordinates": [ 174.67, -36.9313 ] } },
{ "type": "Feature", "properties": { "id": "a0l4a0000004HNa", "Event": "Westside Fitness Henderson 13/08/21", "Location": "21 Catherine Street, Henderson, Auckland 0612", "City": "Auckland", "Start": "2021-08-13T17:30:00Z", "End": "2021-08-13T18:30:00Z", "Advice": "Isolate at home for 14 days from date of last exposure. Test immediately, and on days 5 & 12 after last exposure. Call Healthline for what to do next.", "Added": "2021-08-23 20:24:27", "lat": -36.883188, "lon": 174.632679 }, "geometry": { "type": "Point", "coordinates": [ 174.632679, -36.883188 ] } },
{ "type": "Feature", "properties": { "id": "a0l4a0000004HKb", "Event": "Green Bay High School 11/08/2021", "Location": "143 - 161 Godley Road, Green Bay, Auckland", "City": "Auckland", "Start": "2021-08-11T08:15:00Z", "End": "2021-08-11T15:30:00Z", "Advice": "Isolate at home for 14 days from date of last exposure. Test immediately, and on days 5 & 12 after last exposure. Call Healthline for what to do next.", "Added": "2021-08-23 20:24:27", "lat": -36.9313, "lon": 174.67 }, "geometry": { "type": "Point", "coordinates": [ 174.67, -36.9313 ] } },
{ "type": "Feature", "properties": { "id": "a0l4a0000004HOx", "Event": "Athletics Auckland Running Event Cornwall Park 14/08/2021", "Location": "Cornwall Park, Green Lane West, Epsom, Auckland 1051", "City": "Auckland", "Start": "2021-08-14T13:30:00Z", "End": "2021-08-14T16:30:00Z", "Advice": "Isolate at home for 14 days from date of last exposure. Test immediately, and on days 5 & 12 after last exposure. Call Healthline for what to do next.", "Added": "2021-08-23 12:58:05", "lat": -36.8972, "lon": 174.7843 }, "geometry": { "type": "Point", "coordinates": [ 174.7843, -36.8972 ] } },
{ "type": "Feature", "properties": { "id": "a0l4a0000004HOi", "Event": "Trail Run Event Totara Park Auckland 15/08/2021", "Location": "Totara Park, 90 Wairere Road, The Gardens, Auckland 2105", "City": "Auckland", "Start": "2021-08-15T08:30:00Z", "End": "2021-08-15T14:30:00Z", "Advice": "Isolate at home for 14 days from date of last exposure. Test immediately, and on days 5 & 12 after last exposure. Call Healthline for what to do next.", "Added": "2021-08-23 12:58:05", "lat": -37.0002, "lon": 174.912 }, "geometry": { "type": "Point", "coordinates": [ 174.912, -37.0002 ] } },
{ "type": "Feature", "properties": { "id": "a0l4a0000004G2l", "Event": "Won Sushi Donburi Auckland CBD 11/8/2021", "Location": "290 Queen Street, Auckland Central, Auckland 1010", "City": "Auckland", "Start": "2021-08-11T12:00:00Z", "End": "2021-08-11T13:00:00Z", "Advice": "Isolate at home for 14 days from date of last exposure. Test immediately, and on days 5 & 12 after last exposure. Call Healthline for what to do next.", "Added": "", "lat": -36.850691, "lon": 174.764852 }, "geometry": { "type": "Point", "coordinates": [ 174.764852, -36.850691 ] } },
{ "type": "Feature", "properties": { "id": "a0l4a0000004G3y", "Event": "Palsun Korean Restaurant 13/8/2021", "Location": "57 Lorne Street, Auckland Central, Auckland 1010", "City": "Auckland", "Start": "2021-08-13T12:30:00Z", "End": "2021-08-13T13:30:00Z", "Advice": "Isolate at home for 14 days from date of last exposure. Test immediately, and on days 5 & 12 after last exposure. Call Healthline for what to do next.", "Added": "", "lat": -36.851933, "lon": 174.764778 }, "geometry": { "type": "Point", "coordinates": [ 174.764778, -36.851933 ] } },
{ "type": "Feature", "properties": { "id": "a0l4a0000004GfY", "Event": "Seaworld Fisheries Ōtara 17/08/2021", "Location": "122 East Tamaki Road, Ōtara, Auckland 2023", "City": "Auckland", "Start": "2021-08-16T13:15:00Z", "End": "2021-08-16T13:20:00Z", "Advice": "Isolate at home for 14 days from date of last exposure. Test immediately, and on days 5 & 12 after last exposure. Call Healthline for what to do next.", "Added": "22/08/2021 9:40", "lat": -36.9616, "lon": 174.874 }, "geometry": { "type": "Point", "coordinates": [ 174.874, -36.9616 ] } },
{ "type": "Feature", "properties": { "id": "a0l4a0000004GeG", "Event": "Vege Oasis Ōtara 17/08/2021", "Location": "3/28 Bairds Road, Papatoetoe, Auckland 2025", "City": "Auckland", "Start": "2021-08-17T16:27:00Z", "End": "2021-08-17T16:37:00Z", "Advice": "Isolate at home for 14 days from date of last exposure. Test immediately, and on days 5 & 12 after last exposure. Call Healthline for what to do next.", "Added": "22/08/2021 9:40", "lat": -36.957899, "lon": 174.85491 }, "geometry": { "type": "Point", "coordinates": [ 174.85491, -36.957899 ] } },
{ "type": "Feature", "properties": { "id": "a0l4a0000004Gf4", "Event": "The Local Doctors GP Ōtara 17/08/2021", "Location": "3 Watford Street, Ōtara, Auckland 2023", "City": "Auckland", "Start": "2021-08-17T10:45:00Z", "End": "2021-08-17T15:15:00Z", "Advice": "Isolate at home for 14 days from date of last exposure. Test immediately, and on days 5 & 12 after last exposure. Call Healthline for what to do next.", "Added": "2021-08-22 19:15:42", "lat": -36.962111, "lon": 174.872911 }, "geometry": { "type": "Point", "coordinates": [ 174.872911, -36.962111 ] } },
{ "type": "Feature", "properties": { "id": "a0l4a0000004Gfs", "Event": "Nandos Botany 16/08/2021", "Location": "1 Town Centre Drive, East Tamaki, Auckland 2016", "City": "Auckland", "Start": "2021-08-16T12:00:00Z", "End": "2021-08-16T12:45:00Z", "Advice": "Isolate at home for 14 days from date of last exposure. Test immediately, and on days 5 & 12 after last exposure. Call Healthline for what to do next.", "Added": "22/08/2021 9:40", "lat": -36.9338, "lon": 174.9134 }, "geometry": { "type": "Point", "coordinates": [ 174.9134, -36.9338 ] } },
{ "type": "Feature", "properties": { "id": "a0l4a0000004Gez", "Event": "Horizon Radiology Ōtara 17/08/2021", "Location": "3 Watford Street, Ōtara, Auckland 2023", "City": "Auckland", "Start": "2021-08-17T14:15:00Z", "End": "2021-08-17T15:30:00Z", "Advice": "Isolate at home for 14 days from date of last exposure. Test immediately, and on days 5 & 12 after last exposure. Call Healthline for what to do next.", "Added": "22/08/2021 13:21", "lat": -36.962111, "lon": 174.872911 }, "geometry": { "type": "Point", "coordinates": [ 174.872911, -36.962111 ] } },
{ "type": "Feature", "properties": { "id": "a0l4a0000004Gf5", "Event": "Wymondley Road Superette Ōtara 16/08/2021", "Location": "2 Wymondley Road, Ōtara, Auckland 2025", "City": "Auckland", "Start": "2021-08-16T14:00:00Z", "End": "2021-08-16T14:10:00Z", "Advice": "Isolate at home for 14 days from date of last exposure. Test immediately, and on days 5 & 12 after last exposure. Call Healthline for what to do next.", "Added": "22/08/2021 9:40", "lat": -36.95756, "lon": 174.859472 }, "geometry": { "type": "Point", "coordinates": [ 174.859472, -36.95756 ] } },
{ "type": "Feature", "properties": { "id": "a0l4a0000004GfJ", "Event": "Ōtāhuhu Pool & Leisure Centre 16/08/2021", "Location": "30 Mason Avenue, Ōtāhuhu, Auckland 1062", "City": "Auckland", "Start": "2021-08-16T16:00:00Z", "End": "2021-08-16T18:30:00Z", "Advice": "Isolate at home for 14 days from date of last exposure. Test immediately, and on days 5 & 12 after last exposure. Call Healthline for what to do next.", "Added": "22/08/2021 9:40", "lat": -36.944521, "lon": 174.840742 }, "geometry": { "type": "Point", "coordinates": [ 174.840742, -36.944521 ] } },
{ "type": "Feature", "properties": { "id": "a0l4a0000004GfO", "Event": "Munchy Mart Auckland University Campus 17/8/21", "Location": "11 Symonds Street, Auckland Central, Auckland 1010", "City": "Auckland", "Start": "2021-08-17T14:00:00Z", "End": "2021-08-17T14:15:00Z", "Advice": "Isolate at home for 14 days from date of last exposure. Test immediately, and on days 5 & 12 after last exposure. Call Healthline for what to do next.", "Added": "22/08/2021 9:40", "lat": -36.851651, "lon": 174.771621 }, "geometry": { "type": "Point", "coordinates": [ 174.771621, -36.851651 ] } },
{ "type": "Feature", "properties": { "id": "a0l4a0000004HDa", "Event": "Pak n Save Clendon 17/08/2021", "Location": "16 Robert Ross Place, Clendon Park, Auckland 2103", "City": "Auckland", "Start": "2021-08-17T09:00:00Z", "End": "2021-08-17T11:00:00Z", "Advice": "Isolate at home for 14 days from date of last exposure. Test immediately, and on days 5 & 12 after last exposure. Call Healthline for what to do next.", "Added": "2021-08-23 08:18:08", "lat": -37.031993, "lon": 174.866987 }, "geometry": { "type": "Point", "coordinates": [ 174.866987, -37.031993 ] } },
{ "type": "Feature", "properties": { "id": "a0l4a0000004HE9", "Event": "PaknSave Clendon park 16/08/2021", "Location": "16 Robert Ross Place, Clendon Park, Auckland 2103", "City": "Auckland", "Start": "2021-08-16T19:00:00Z", "End": "2021-08-16T19:30:00Z", "Advice": "Customers at or around the entrance: Isolate, test immediately and on or around day 5 after last exposure and continue to isolate until negative day 5 test result. Call Healthline for what to do next.", "Added": "2021-08-23 14:14:45", "lat": -37.031993, "lon": 174.866987 }, "geometry": { "type": "Point", "coordinates": [ 174.866987, -37.031993 ] } },
{ "type": "Feature", "properties": { "id": "a0l4a0000004HBe", "Event": "Room 416 WZ Building AUT City Campus 11/08/2021", "Location": "55 Wellesley Street East, Auckland Central, Auckland 1010", "City": "Auckland", "Start": "2021-08-11T15:00:00Z", "End": "2021-08-11T16:30:00Z", "Advice": "All at CRIM781 - Prisons and Punishments: Isolate at home for 14 days from date of last exposure. Test immediately, and on days 5 & 12 after last exposure. Call Healthline for what to do next.", "Added": "2021-08-24 14:14:30", "lat": -36.852634, "lon": 174.766787 }, "geometry": { "type": "Point", "coordinates": [ 174.766787, -36.852634 ] } },
{ "type": "Feature", "properties": { "id": "a0l4a0000004HDu", "Event": "Countdown Manurewa 16/08/21", "Location": "227 Browns Road, Manurewa, Auckland 2102", "City": "Auckland", "Start": "2021-08-16T12:00:00Z", "End": "2021-08-16T12:30:00Z", "Advice": "Isolate at home for 14 days from date of last exposure. Test immediately, and on days 5 & 12 after last exposure. Call Healthline for what to do next.", "Added": "2021-08-23 08:18:08", "lat": -37.017815, "lon": 174.864831 }, "geometry": { "type": "Point", "coordinates": [ 174.864831, -37.017815 ] } },
{ "type": "Feature", "properties": { "id": "a0l4a0000004HDV", "Event": "Clendon Dairy Clendon Park 17/08/2021", "Location": "469 Roscommon Road, Clendon Park, Auckland 2103", "City": "Auckland", "Start": "2021-08-17T11:30:00Z", "End": "2021-08-17T12:00:00Z", "Advice": "Isolate at home for 14 days from date of last exposure. Test immediately, and on days 5 & 12 after last exposure. Call Healthline for what to do next.", "Added": "2021-08-23 14:14:45", "lat": -37.0335, "lon": 174.8683 }, "geometry": { "type": "Point", "coordinates": [ 174.8683, -37.0335 ] } },
{ "type": "Feature", "properties": { "id": "a0l4a0000004HCS", "Event": "Level 3 Library AUT City Campus 10/08/2021", "Location": "55 Wellesley Street East, Auckland Central, Auckland 1010", "City": "Auckland", "Start": "2021-08-10T10:45:00Z", "End": "2021-08-10T19:00:00Z", "Advice": "Isolate at home for 14 days from date of last exposure. Test immediately, and on days 5 & 12 after last exposure. Call Healthline for what to do next.", "Added": "2021-08-24 14:14:30", "lat": -36.852634, "lon": 174.766787 }, "geometry": { "type": "Point", "coordinates": [ 174.766787, -36.852634 ] } },
{ "type": "Feature", "properties": { "id": "a0l4a0000004HEE", "Event": "Mobil Blockhouse Bay Avondale 17/08/2021", "Location": "262 Blockhouse Bay Road, Avondale, Auckland 0600", "City": "Auckland", "Start": "2021-08-17T22:30:00Z", "End": "2021-08-17T23:00:00Z", "Advice": "Isolate at home for 14 days from date of last exposure. Test immediately, and on days 5 & 12 after last exposure. Call Healthline for what to do next.", "Added": "2021-08-22 19:15:42", "lat": -36.906244, "lon": 174.701837 }, "geometry": { "type": "Point", "coordinates": [ 174.701837, -36.906244 ] } },
{ "type": "Feature", "properties": { "id": "a0l4a0000004HE4", "Event": "Rosebank School Avondale 17/08/2021", "Location": "217 Rosebank Road, Avondale, Auckland 1026", "City": "Auckland", "Start": "2021-08-17T09:00:00Z", "End": "2021-08-17T15:00:00Z", "Advice": "Those required to isolate and test have been identified and contacted by Public Health. All others, monitor symptoms for 14 days post exposure, if they become unwell have a test, isolate and call Healthline for advice.", "Added": "2021-08-23 18:42:37", "lat": -36.888722, "lon": 174.685979 }, "geometry": { "type": "Point", "coordinates": [ 174.685979, -36.888722 ] } },
{ "type": "Feature", "properties": { "id": "a0l4a0000004HC8", "Event": "Breadwinners Bakery", "Location": "8 Saint Heliers Bay Road,, St Heliers,, Auckland 1071", "City": "Auckland", "Start": "2021-08-14T10:50:00Z", "End": "2021-08-14T11:10:00Z", "Advice": "Isolate at home for 14 days from date of last exposure. Test immediately, and on days 5 & 12 after last exposure. Call Healthline for what to do next.", "Added": "2021-08-23 18:42:37", "lat": -36.8505, "lon": 174.8576 }, "geometry": { "type": "Point", "coordinates": [ 174.8576, -36.8505 ] } },
{ "type": "Feature", "properties": { "id": "a0l4a0000004HFC", "Event": "Mission Bay Liquor Mission Bay 14/08/2021", "Location": "21/35 Tamaki Drive,, Mission Bay,, Auckland 1071", "City": "Auckland", "Start": "2021-08-14T16:40:00Z", "End": "2021-08-14T16:55:00Z", "Advice": "Isolate at home for 14 days from date of last exposure. Test immediately, and on days 5 & 12 after last exposure. Call Healthline for what to do next.", "Added": "2021-08-23 18:42:37", "lat": -36.8479, "lon": 174.8295 }, "geometry": { "type": "Point", "coordinates": [ 174.8295, -36.8479 ] } },
{ "type": "Feature", "properties": { "id": "a0l4a0000004HGe", "Event": "Z Petrol Station Manurewa 17/08/2021", "Location": "1 Alfriston Road, Manurewa, Auckland 2102", "City": "Auckland", "Start": "2021-08-17T08:00:00Z", "End": "2021-08-17T08:15:00Z", "Advice": "Isolate at home for 14 days from date of last exposure. Test immediately, and on days 5 & 12 after last exposure. Call Healthline for what to do next.", "Added": "2021-08-23 20:24:27", "lat": -37.023385, "lon": 174.899521 }, "geometry": { "type": "Point", "coordinates": [ 174.899521, -37.023385 ] } },
{ "type": "Feature", "properties": { "id": "a0l4a0000004Ggg", "Event": "Wellington Domestic Airport 19/08/2021", "Location": "1 Stewart Duff Drive, Rongotai, Wellington 6022", "City": "Wellington", "Start": "2021-08-19T17:30:00Z", "End": "2021-08-19T18:15:00Z", "Advice": "Self-monitor for COVID-19 symptoms for 14 days. If symptoms develop, get a test and stay at home until you get a negative test result AND until 24 hours after symptoms resolve.", "Added": "22/08/2021 9:40", "lat": -41.334678, "lon": 174.809911 }, "geometry": { "type": "Point", "coordinates": [ 174.809911, -41.334678 ] } },
{ "type": "Feature", "properties": { "id": "a0l4a0000004GnI", "Event": "Knobs & Knockers Grafton 16/08/2021", "Location": "1 Burton Street, Grafton, Auckland 1010", "City": "Auckland", "Start": "2021-08-16T12:00:00Z", "End": "2021-08-16T12:20:00Z", "Advice": "Isolate at home for 14 days from date of last exposure. Test immediately, and on days 5 & 12 after last exposure. Call Healthline for what to do next.", "Added": "2021-08-22 19:15:42", "lat": -36.863275, "lon": 174.763822 }, "geometry": { "type": "Point", "coordinates": [ 174.763822, -36.863275 ] } },
{ "type": "Feature", "properties": { "id": "a0l4a0000004Gs8", "Event": "Kmart St Lukes 17/08/2021", "Location": "72 St Lukes Road, Mount Albert, Auckland 1025", "City": "Auckland", "Start": "2021-08-17T20:45:00Z", "End": "2021-08-17T21:05:00Z", "Advice": "Isolate at home for 14 days from date of last exposure. Test immediately, and on days 5 & 12 after last exposure. Call Healthline for what to do next.", "Added": "2021-08-22 16:08:28", "lat": -36.882922, "lon": 174.732213 }, "geometry": { "type": "Point", "coordinates": [ 174.732213, -36.882922 ] } },
{ "type": "Feature", "properties": { "id": "a0l4a0000004GsD", "Event": "Farro Grey Lynn 18/08/2021", "Location": "34 Westmoreland Street West, Grey Lynn, Auckland 1021", "City": "Auckland", "Start": "2021-08-18T16:33:00Z", "End": "2021-08-18T16:45:00Z", "Advice": "Isolate at home for 14 days from date of last exposure. Test immediately, and on days 5 & 12 after last exposure. Call Healthline for what to do next.", "Added": "2021-08-22 16:08:28", "lat": -36.855255, "lon": 174.732961 }, "geometry": { "type": "Point", "coordinates": [ 174.732961, -36.855255 ] } },
{ "type": "Feature", "properties": { "id": "a0l4a0000004GsI", "Event": "Countdown Grey Lynn 18/08/2021", "Location": "271 Richmond Road, Grey Lynn, Auckland 1022", "City": "Auckland", "Start": "2021-08-18T16:55:00Z", "End": "2021-08-18T17:30:00Z", "Advice": "Stay at home, test immediately and on or around day 5 after last exposure and continue to stay at home until you receive a negative day 5 test result. Call Healthline for what to do next.", "Added": "2021-08-22 16:08:28", "lat": -36.854351, "lon": 174.731873 }, "geometry": { "type": "Point", "coordinates": [ 174.731873, -36.854351 ] } },
{ "type": "Feature", "properties": { "id": "a0l4a0000004H0g", "Event": "Countdown Māngere Mall 17/08/2021", "Location": "Māngere Town Centre, Bader Dve,, Māngere, Auckland 2022", "City": "Auckland", "Start": "2021-08-17T12:30:00Z", "End": "2021-08-17T13:00:00Z", "Advice": "Isolate at home for 14 days from date of last exposure. Test immediately, and on days 5 & 12 after last exposure. Call Healthline for what to do next.", "Added": "2021-08-23 20:24:27", "lat": -36.9701, "lon": 174.8009 }, "geometry": { "type": "Point", "coordinates": [ 174.8009, -36.9701 ] } },
{ "type": "Feature", "properties": { "id": "a0l4a0000004H0v", "Event": "Pizzahut Māngere 17/08/2021", "Location": "1/44 Orly Avenue, Māngere, Auckland 2022", "City": "Auckland", "Start": "2021-08-17T18:00:00Z", "End": "2021-08-17T18:20:00Z", "Advice": "Isolate at home for 14 days from date of last exposure. Test immediately, and on days 5 & 12 after last exposure. Call Healthline for what to do next.", "Added": "2021-08-23 20:24:27", "lat": -36.969129, "lon": 174.797706 }, "geometry": { "type": "Point", "coordinates": [ 174.797706, -36.969129 ] } },
{ "type": "Feature", "properties": { "id": "a0l4a0000004H0b", "Event": "Mobil Māngere 17/08/2021", "Location": "747 Massey Road, Māngere, Auckland 2022", "City": "Auckland", "Start": "2021-08-17T11:00:00Z", "End": "2021-08-17T11:30:00Z", "Advice": "Isolate at home for 14 days from date of last exposure. Test immediately, and on days 5 & 12 after last exposure. Call Healthline for what to do next.", "Added": "2021-08-23 20:24:27", "lat": -36.975998, "lon": 174.796466 }, "geometry": { "type": "Point", "coordinates": [ 174.796466, -36.975998 ] } },
{ "type": "Feature", "properties": { "id": "a0l4a0000004HKR", "Event": "Green Bay High School 13/08/2021", "Location": "143 - 161 Godley Road, Green Bay, Auckland", "City": "Auckland", "Start": "2021-08-13T08:15:00Z", "End": "2021-08-13T15:30:00Z", "Advice": "Isolate at home for 14 days from date of last exposure. Test immediately, and on days 5 & 12 after last exposure. Call Healthline for what to do next.", "Added": "2021-08-23 20:24:27", "lat": -36.9313, "lon": 174.67 }, "geometry": { "type": "Point", "coordinates": [ 174.67, -36.9313 ] } },
{ "type": "Feature", "properties": { "id": "a0l4a0000004ESY", "Event": "Umu Cafe Coromandel 14/08/21", "Location": "22 Wharf Road, Coromandel 3506", "City": "Coromandel", "Start": "2021-08-14T18:17:00Z", "End": "2021-08-14T19:11:00Z", "Advice": "Isolate at home for 14 days from date of last exposure. Test immediately, and on days 5 & 12 after last exposure. Call Healthline for what to do next.", "Added": "", "lat": -36.760098, "lon": 175.497078 }, "geometry": { "type": "Point", "coordinates": [ 175.497078, -36.760098 ] } },
{ "type": "Feature", "properties": { "id": "a0l4a0000004ESi", "Event": "Taras Beads Coromandel 14/08/21", "Location": "1/75 Kapanga Road, Coromandel 3506", "City": "Coromandel", "Start": "2021-08-14T15:00:00Z", "End": "2021-08-14T15:10:00Z", "Advice": "Isolate at home for 14 days from date of last exposure. Test immediately, and on days 5 & 12 after last exposure. Call Healthline for what to do next.", "Added": "", "lat": -36.759513, "lon": 175.497652 }, "geometry": { "type": "Point", "coordinates": [ 175.497652, -36.759513 ] } },
{ "type": "Feature", "properties": { "id": "a0l4a0000004ESJ", "Event": "Richardsons Real Estate Coromandel 14/08/21", "Location": "151 Kapanga Road, Coromandel 3506", "City": "Coromandel", "Start": "2021-08-14T15:30:00Z", "End": "2021-08-14T15:35:00Z", "Advice": "Isolate at home for 14 days from date of last exposure. Test immediately, and on days 5 & 12 after last exposure. Call Healthline for what to do next.", "Added": "", "lat": -36.758518, "lon": 175.498133 }, "geometry": { "type": "Point", "coordinates": [ 175.498133, -36.758518 ] } },
{ "type": "Feature", "properties": { "id": "a0l4a0000004ET2", "Event": "Taras Beads Coromandel 15/08/21", "Location": "1/75 Kapanga Road, Coromandel 3506", "City": "Coromandel", "Start": "2021-08-15T10:00:00Z", "End": "2021-08-15T10:05:00Z", "Advice": "Isolate at home for 14 days from date of last exposure. Test immediately, and on days 5 & 12 after last exposure. Call Healthline for what to do next.", "Added": "", "lat": -36.759513, "lon": 175.497652 }, "geometry": { "type": "Point", "coordinates": [ 175.497652, -36.759513 ] } },
{ "type": "Feature", "properties": { "id": "a0l4a0000004EUP", "Event": "Crumb Grey Lynn 12/08/21", "Location": "37 Ariki Street, Grey Lynn, Auckland 1021", "City": "Auckland", "Start": "2021-08-12T10:00:00Z", "End": "2021-08-12T10:10:00Z", "Advice": "Isolate at home for 14 days from date of last exposure. Test immediately, and on days 5 & 12 after last exposure. Call Healthline for what to do next.", "Added": "", "lat": -36.862504, "lon": 174.74508 }, "geometry": { "type": "Point", "coordinates": [ 174.74508, -36.862504 ] } },
{ "type": "Feature", "properties": { "id": "a0l4a0000004EUe", "Event": "Umu Cafe Coromandel 15/08/21", "Location": "22 Wharf Road, Coromandel 3506", "City": "Coromandel", "Start": "2021-08-15T10:14:00Z", "End": "2021-08-15T11:10:00Z", "Advice": "Isolate at home for 14 days from date of last exposure. Test immediately, and on days 5 & 12 after last exposure. Call Healthline for what to do next.", "Added": "", "lat": -36.760098, "lon": 175.497078 }, "geometry": { "type": "Point", "coordinates": [ 175.497078, -36.760098 ] } },
{ "type": "Feature", "properties": { "id": "a0l4a0000004EVc", "Event": "Woodturners Cafe Thames 15/08/21", "Location": "State Highway 2, RD6, Mangatarata 3576", "City": "Mangatarata", "Start": "2021-08-15T12:40:00Z", "End": "2021-08-15T13:25:00Z", "Advice": "Isolate at home for 14 days from date of last exposure. Test immediately, and on days 5 & 12 after last exposure. Call Healthline for what to do next.", "Added": "", "lat": -37.2902, "lon": 175.381 }, "geometry": { "type": "Point", "coordinates": [ 175.381, -37.2902 ] } },
{ "type": "Feature", "properties": { "id": "a0l4a0000004EhJ", "Event": "The Warehouse Auckland CBD 10/08/2021", "Location": "21 Elliott Street, Auckland Central, Auckland 1010", "City": "Auckland", "Start": "2021-08-10T13:15:00Z", "End": "2021-08-10T13:30:00Z", "Advice": "Isolate at home for 14 days from date of last exposure. Test immediately, and on days 5 & 12 after last exposure. Call Healthline for what to do next.", "Added": "", "lat": -36.849789, "lon": 174.763803 }, "geometry": { "type": "Point", "coordinates": [ 174.763803, -36.849789 ] } },
{ "type": "Feature", "properties": { "id": "a0l4a0000004EhO", "Event": "Event Cinemas Queen Street Auckland 10/08/2021", "Location": "1/291 Queen Street, Auckland Central, Auckland 1010", "City": "Auckland", "Start": "2021-08-10T13:30:00Z", "End": "2021-08-10T16:00:00Z", "Advice": "Isolate at home for 14 days from date of last exposure. Test immediately, and on days 5 & 12 after last exposure. Call Healthline for what to do next.", "Added": "", "lat": -36.851528, "lon": 174.763851 }, "geometry": { "type": "Point", "coordinates": [ 174.763851, -36.851528 ] } },
{ "type": "Feature", "properties": { "id": "a0l4a0000004EhE", "Event": "St Pierre's Sushi Auckland CBD 10/08/2021", "Location": "G14/20 Elliott Street, Auckland Central, Auckland 1010", "City": "Auckland", "Start": "2021-08-10T11:30:00Z", "End": "2021-08-10T13:15:00Z", "Advice": "Isolate at home for 14 days from date of last exposure. Test immediately, and on days 5 & 12 after last exposure. Call Healthline for what to do next.", "Added": "", "lat": -36.850179, "lon": 174.763929 }, "geometry": { "type": "Point", "coordinates": [ 174.763929, -36.850179 ] } },
{ "type": "Feature", "properties": { "id": "a0l4a0000004Ehs", "Event": "Avondale College 13/08/2021", "Location": "51 Victor Street, Avondale, Auckland 1026", "City": "Auckland", "Start": "2021-08-13T08:45:00Z", "End": "2021-08-13T15:15:00Z", "Advice": "Isolate at home for 14 days from date of last exposure. Test immediately, and on days 5 & 12 after last exposure. Call Healthline for what to do next.", "Added": "", "lat": -36.891758, "lon": 174.69079 }, "geometry": { "type": "Point", "coordinates": [ 174.69079, -36.891758 ] } },
{ "type": "Feature", "properties": { "id": "a0l4a0000004ElR", "Event": "Westfield Mall Albany 13/08/2021", "Location": "219 Don McKinnon Drive, Albany, Auckland 0632", "City": "Auckland", "Start": "2021-08-13T17:10:00Z", "End": "2021-08-13T18:30:00Z", "Advice": "Isolate at home for 14 days from date of last exposure. Test immediately, and on days 5 & 12 after last exposure. Call Healthline for what to do next.", "Added": "", "lat": -36.726809, "lon": 174.705609 }, "geometry": { "type": "Point", "coordinates": [ 174.705609, -36.726809 ] } },
{ "type": "Feature", "properties": { "id": "a0l4a0000004EmE", "Event": "Dennys Auckland CBD 14/08/2021", "Location": "51 Hobson Street, Auckland CBD, Auckland 1010", "City": "Auckland", "Start": "2021-08-14T01:00:00Z", "End": "2021-08-14T01:30:00Z", "Advice": "Isolate at home for 14 days from date of last exposure. Test immediately, and on days 5 & 12 after last exposure. Call Healthline for what to do next.", "Added": "", "lat": -36.8475, "lon": 174.7617 }, "geometry": { "type": "Point", "coordinates": [ 174.7617, -36.8475 ] } },
{ "type": "Feature", "properties": { "id": "a0l4a0000004Emd", "Event": "Sky City Casino Auckland 14/08/2021", "Location": "72 Victoria Street West, Auckland Central, Auckland 1010", "City": "Auckland", "Start": "2021-08-14T01:17:00Z", "End": "2021-08-14T03:08:00Z", "Advice": "Isolate at home for 14 days from date of last exposure. Test immediately, and on days 5 & 12 after last exposure. Call Healthline for what to do next.", "Added": "", "lat": -36.848363, "lon": 174.762288 }, "geometry": { "type": "Point", "coordinates": [ 174.762288, -36.848363 ] } },
{ "type": "Feature", "properties": { "id": "a0l4a0000004Emx", "Event": "Green Bay Takeaways Green Bay 16/08/2021", "Location": "56B Godley Road, Green Bay, Auckland 0604", "City": "Auckland", "Start": "2021-08-16T16:00:00Z", "End": "2021-08-16T16:15:00Z", "Advice": "Isolate at home for 14 days from date of last exposure. Test immediately, and on days 5 & 12 after last exposure. Call Healthline for what to do next.", "Added": "", "lat": -36.930594, "lon": 174.680132 }, "geometry": { "type": "Point", "coordinates": [ 174.680132, -36.930594 ] } },
{ "type": "Feature", "properties": { "id": "a0l4a0000004En7", "Event": "Passion Bakery Birkdale 16/08/2021", "Location": "34 Birkdale Road, Birkdale, Auckland 0626", "City": "Auckland", "Start": "2021-08-16T12:45:00Z", "End": "2021-08-16T13:15:00Z", "Advice": "Isolate at home for 14 days from date of last exposure. Test immediately, and on days 5 & 12 after last exposure. Call Healthline for what to do next.", "Added": "", "lat": -36.805899, "lon": 174.704483 }, "geometry": { "type": "Point", "coordinates": [ 174.704483, -36.805899 ] } },
{ "type": "Feature", "properties": { "id": "a0l4a0000004En8", "Event": "Countdown Birkenhead 16/08/2021", "Location": "Cnr Highbury Pass & Birkenhead Ave, Birkenhead, Auckland 0626", "City": "Auckland", "Start": "2021-08-16T12:30:00Z", "End": "2021-08-16T12:45:00Z", "Advice": "Isolate at home for 14 days from date of last exposure. Test immediately, and on days 5 & 12 after last exposure. Call Healthline for what to do next.", "Added": "", "lat": -36.8113, "lon": 174.725 }, "geometry": { "type": "Point", "coordinates": [ 174.725, -36.8113 ] } },
{ "type": "Feature", "properties": { "id": "a0l4a0000004Emi", "Event": "Unichem Pharmacy Birkenhead 17/08/2021", "Location": "Birkenhead Avenue Shop 28, Highbury Shopping Centre, Birkenhead, Auckland 0626", "City": "Auckland", "Start": "2021-08-17T09:15:00Z", "End": "2021-08-17T09:30:00Z", "Advice": "Isolate at home for 14 days from date of last exposure. Test immediately, and on days 5 & 12 after last exposure. Call Healthline for what to do next.", "Added": "", "lat": -36.8107, "lon": 174.7263 }, "geometry": { "type": "Point", "coordinates": [ 174.7263, -36.8107 ] } },
{ "type": "Feature", "properties": { "id": "a0l4a0000004EnR", "Event": "Warehouse New Lynn 16/08/2021", "Location": "7/13 Rata Street, New Lynn, Auckland 0600", "City": "Auckland", "Start": "2021-08-16T07:45:00Z", "End": "2021-08-16T08:15:00Z", "Advice": "Isolate at home for 14 days from date of last exposure. Test immediately, and on days 5 & 12 after last exposure. Call Healthline for what to do next.", "Added": "", "lat": -36.9077, "lon": 174.6784 }, "geometry": { "type": "Point", "coordinates": [ 174.6784, -36.9077 ] } },
{ "type": "Feature", "properties": { "id": "a0l4a0000004Eng", "Event": "Countdown Birkenhead 16/08/2021", "Location": "Cnr Highbury Pass & Birkenhead Ave, Birkenhead, Auckland 0626", "City": "Auckland", "Start": "2021-08-16T07:00:00Z", "End": "2021-08-16T07:15:00Z", "Advice": "Isolate at home for 14 days from date of last exposure. Test immediately, and on days 5 & 12 after last exposure. Call Healthline for what to do next.", "Added": "", "lat": -36.8113, "lon": 174.725 }, "geometry": { "type": "Point", "coordinates": [ 174.725, -36.8113 ] } },
{ "type": "Feature", "properties": { "id": "a0l4a0000004Enq", "Event": "BP Northcote 15/08/2021", "Location": "50 Northcote Road, Northcote, Auckland 0627", "City": "Auckland", "Start": "2021-08-15T19:15:00Z", "End": "2021-08-15T19:30:00Z", "Advice": "Isolate at home for 14 days from date of last exposure. Test immediately, and on days 5 & 12 after last exposure. Call Healthline for what to do next.", "Added": "", "lat": -36.7935, "lon": 174.7464 }, "geometry": { "type": "Point", "coordinates": [ 174.7464, -36.7935 ] } },
{ "type": "Feature", "properties": { "id": "a0l4a0000004Env", "Event": "Countdown Glenfield Mall 14/08/2021", "Location": "Cnr Bentley Ave &, Glenfield Road, Glenfield,, Auckland 0629", "City": "Auckland", "Start": "2021-08-14T17:00:00Z", "End": "2021-08-14T17:15:00Z", "Advice": "Isolate at home for 14 days from date of last exposure. Test immediately, and on days 5 & 12 after last exposure. Call Healthline for what to do next.", "Added": "", "lat": -36.7825, "lon": 174.7231 }, "geometry": { "type": "Point", "coordinates": [ 174.7231, -36.7825 ] } },
{ "type": "Feature", "properties": { "id": "a0l4a0000004EpN", "Event": "Mamak Malaysian Restaurant 17/08/2021", "Location": "50 Kitchener Street, Auckland Central, Auckland 1010", "City": "Auckland", "Start": "2021-08-17T13:15:00Z", "End": "2021-08-17T13:30:00Z", "Advice": "Isolate at home for 14 days from date of last exposure. Test immediately, and on days 5 & 12 after last exposure. Call Healthline for what to do next.", "Added": "", "lat": -36.848316, "lon": 174.767669 }, "geometry": { "type": "Point", "coordinates": [ 174.767669, -36.848316 ] } },
{ "type": "Feature", "properties": { "id": "a0l4a0000004Epm", "Event": "Glenfield Mall / Katsubi Japanese 15/08/2021", "Location": "Glenfield Road & Downing Street, Glenfield, Auckland 0629", "City": "Auckland", "Start": "2021-08-15T13:00:00Z", "End": "2021-08-15T14:00:00Z", "Advice": "Isolate at home for 14 days from date of last exposure. Test immediately, and on days 5 & 12 after last exposure. Call Healthline for what to do next.", "Added": "", "lat": -36.7817, "lon": 174.7215 }, "geometry": { "type": "Point", "coordinates": [ 174.7215, -36.7817 ] } },
{ "type": "Feature", "properties": { "id": "a0l4a0000004EpS", "Event": "The Pumphouse Theatre Takapuna 15/08/2021", "Location": "2A Manurere Avenue, Takapuna, Auckland 0622", "City": "Auckland", "Start": "2021-08-15T15:30:00Z", "End": "2021-08-15T19:00:00Z", "Advice": "Isolate at home for 14 days from date of last exposure. Test immediately, and on days 5 & 12 after last exposure. Call Healthline for what to do next.", "Added": "", "lat": -36.784597, "lon": 174.768334 }, "geometry": { "type": "Point", "coordinates": [ 174.768334, -36.784597 ] } },
{ "type": "Feature", "properties": { "id": "a0l4a0000004Erd", "Event": "McDonalds Glenfield 14/08/2021", "Location": "Cnr Glenfield &, Kaipatiki Road,, Glenfield, Auckland 0629", "City": "Auckland", "Start": "2021-08-14T01:00:00Z", "End": "2021-08-14T01:15:00Z", "Advice": "Isolate at home for 14 days from date of last exposure. Test immediately, and on days 5 & 12 after last exposure. Call Healthline for what to do next.", "Added": "", "lat": -36.7821, "lon": 174.721 }, "geometry": { "type": "Point", "coordinates": [ 174.721, -36.7821 ] } },
{ "type": "Feature", "properties": { "id": "a0l4a0000004EqQ", "Event": "Pak n Save Wairau 15/08/2021", "Location": "30-60 Wairau Road, Glenfield, Auckland 0627", "City": "Auckland", "Start": "2021-08-15T11:00:00Z", "End": "2021-08-15T12:00:00Z", "Advice": "Isolate at home for 14 days from date of last exposure. Test immediately, and on days 5 & 12 after last exposure. Call Healthline for what to do next.", "Added": "", "lat": -36.7778, "lon": 174.7443 }, "geometry": { "type": "Point", "coordinates": [ 174.7443, -36.7778 ] } },
{ "type": "Feature", "properties": { "id": "a0l4a0000004Er4", "Event": "The Good Home Birkenhhead 14/08/2021", "Location": "83 Birkenhead Avenue, Birkenhead, Auckland 0626", "City": "Auckland", "Start": "2021-08-14T18:30:00Z", "End": "2021-08-14T22:00:00Z", "Advice": "Isolate at home for 14 days from date of last exposure. Test immediately, and on days 5 & 12 after last exposure. Call Healthline for what to do next.", "Added": "", "lat": -36.810556, "lon": 174.725852 }, "geometry": { "type": "Point", "coordinates": [ 174.725852, -36.810556 ] } },
{ "type": "Feature", "properties": { "id": "a0l4a0000004EqG", "Event": "Latin Market near La Pachamama 15/08/2021", "Location": "Near 179a Archers Road, Glenfield, Auckland 0629", "City": "Auckland", "Start": "2021-08-15T12:30:00Z", "End": "2021-08-15T12:45:00Z", "Advice": "Isolate at home for 14 days from date of last exposure. Test immediately, and on days 5 & 12 after last exposure. Call Healthline for what to do next.", "Added": "", "lat": -36.7808, "lon": 174.7384 }, "geometry": { "type": "Point", "coordinates": [ 174.7384, -36.7808 ] } },
{ "type": "Feature", "properties": { "id": "a0l4a0000004Equ", "Event": "BP Birkenhead 15/08/2021", "Location": "172-178 Mokoia Road, Birkenhead, Auckland 0626", "City": "Auckland", "Start": "2021-08-15T10:30:00Z", "End": "2021-08-15T10:45:00Z", "Advice": "Isolate at home for 14 days from date of last exposure. Test immediately, and on days 5 & 12 after last exposure. Call Healthline for what to do next.", "Added": "", "lat": -36.8108, "lon": 174.7125 }, "geometry": { "type": "Point", "coordinates": [ 174.7125, -36.8108 ] } },
{ "type": "Feature", "properties": { "id": "a0l4a0000004Erx", "Event": "Bar 101 Auckland CBD 13/08/2021", "Location": "18 Elliott Street, ,, Auckland CBD, Auckland 1010", "City": "Auckland", "Start": "2021-08-13T23:43:00Z", "End": "2021-08-14T01:13:00Z", "Advice": "Isolate at home for 14 days from date of last exposure. Test immediately, and on days 5 & 12 after last exposure. Call Healthline for what to do next.", "Added": "", "lat": -36.8497, "lon": 174.7642 }, "geometry": { "type": "Point", "coordinates": [ 174.7642, -36.8497 ] } },
{ "type": "Feature", "properties": { "id": "a0l4a0000004EqL", "Event": "Central Auckland Church of Christ 15/08/2021", "Location": "52 Hepburn Street, Freemans Bay, Auckland 1011", "City": "Auckland", "Start": "2021-08-15T10:15:00Z", "End": "2021-08-15T12:02:00Z", "Advice": "Isolate at home for 14 days from date of last exposure. Test immediately, and on days 5 & 12 after last exposure. Call Healthline for what to do next.", "Added": "", "lat": -36.853164, "lon": 174.751289 }, "geometry": { "type": "Point", "coordinates": [ 174.751289, -36.853164 ] } },
{ "type": "Feature", "properties": { "id": "a0l4a0000004EsM", "Event": "Pak n Save Wairau Road 14/08/2021", "Location": "30 Wairau Road, Wairau Valley, Auckland 0627", "City": "Auckland", "Start": "2021-08-14T15:20:00Z", "End": "2021-08-14T15:51:00Z", "Advice": "Isolate at home for 14 days from date of last exposure. Test immediately, and on days 5 & 12 after last exposure. Call Healthline for what to do next.", "Added": "", "lat": -36.77882, "lon": 174.74397 }, "geometry": { "type": "Point", "coordinates": [ 174.74397, -36.77882 ] } },
{ "type": "Feature", "properties": { "id": "a0l4a0000004Esv", "Event": "Auckland University of Technology 17/08/2021", "Location": "2 Governor Fitzroy Place, Auckland Central, Auckland 1010", "City": "Auckland", "Start": "2021-08-17T11:30:00Z", "End": "2021-08-17T15:45:00Z", "Advice": "Staff & students at lecture theatre WG403 or the level 4 foyer outside will be sent information on isolation and testing by AUT.  Students and staff elsewhere on the city campus need to follow Level 4 instructions and call Healthline if symptoms develop.", "Added": "22/08/2021 9:40", "lat": -36.853386, "lon": 174.765736 }, "geometry": { "type": "Point", "coordinates": [ 174.765736, -36.853386 ] } },
{ "type": "Feature", "properties": { "id": "a0l4a0000004Esb", "Event": "Liquor King Ponsonby 13/08/2021", "Location": "254 Ponsonby Road, Ponsonby, Auckland 1011", "City": "Auckland", "Start": "2021-08-13T20:15:00Z", "End": "2021-08-13T20:45:00Z", "Advice": "Isolate at home for 14 days from date of last exposure. Test immediately, and on days 5 & 12 after last exposure. Call Healthline for what to do next.", "Added": "", "lat": -36.850994, "lon": 174.7444 }, "geometry": { "type": "Point", "coordinates": [ 174.7444, -36.850994 ] } },
{ "type": "Feature", "properties": { "id": "a0l4a0000004F4T", "Event": "Mitre 10 Mega Glenfield 13/08/21", "Location": "15 Poland Road, Wairau Valley, Auckland 0627", "City": "Auckland", "Start": "2021-08-13T15:15:00Z", "End": "2021-08-13T15:45:00Z", "Advice": "Isolate at home for 14 days from date of last exposure. Test immediately, and on days 5 & 12 after last exposure. Call Healthline for what to do next.", "Added": "", "lat": -36.776641, "lon": 174.740841 }, "geometry": { "type": "Point", "coordinates": [ 174.740841, -36.776641 ] } },
{ "type": "Feature", "properties": { "id": "a0l4a0000004F5u", "Event": "Burger King Wairau Park 12/08/21", "Location": "22 Link Drive, Wairau Valley, Auckland 0627", "City": "Auckland", "Start": "2021-08-12T17:30:00Z", "End": "2021-08-12T18:00:00Z", "Advice": "Isolate at home for 14 days from date of last exposure. Test immediately, and on days 5 & 12 after last exposure. Call Healthline for what to do next.", "Added": "", "lat": -36.763049, "lon": 174.737065 }, "geometry": { "type": "Point", "coordinates": [ 174.737065, -36.763049 ] } },
{ "type": "Feature", "properties": { "id": "a0l4a0000004F4D", "Event": "KMart Westfield Albany 13/08/21", "Location": "219 Don McKinnon Drive, Albany, Auckland 0632", "City": "Auckland", "Start": "2021-08-13T17:30:00Z", "End": "2021-08-13T17:45:00Z", "Advice": "Isolate at home for 14 days from date of last exposure. Test immediately, and on days 5 & 12 after last exposure. Call Healthline for what to do next.", "Added": "", "lat": -36.726809, "lon": 174.705609 }, "geometry": { "type": "Point", "coordinates": [ 174.705609, -36.726809 ] } },
{ "type": "Feature", "properties": { "id": "a0l4a0000004F4h", "Event": "JB HiFi Westfield Albany 13/08/21", "Location": "219 Don McKinnon Drive, Albany, Auckland 0632", "City": "Auckland", "Start": "2021-08-13T17:15:00Z", "End": "2021-08-13T17:30:00Z", "Advice": "Isolate at home for 14 days from date of last exposure. Test immediately, and on days 5 & 12 after last exposure. Call Healthline for what to do next.", "Added": "", "lat": -36.726809, "lon": 174.705609 }, "geometry": { "type": "Point", "coordinates": [ 174.705609, -36.726809 ] } },
{ "type": "Feature", "properties": { "id": "a0l4a0000004F5a", "Event": "Pascoes Glenfield Mall 14/8/21", "Location": "Glenfield Rd, Glenfield, Auckland 0629", "City": "Auckland", "Start": "2021-08-14T11:30:00Z", "End": "2021-08-14T11:45:00Z", "Advice": "Isolate at home for 14 days from date of last exposure. Test immediately, and on days 5 & 12 after last exposure. Call Healthline for what to do next.", "Added": "", "lat": -36.782, "lon": 174.7222 }, "geometry": { "type": "Point", "coordinates": [ 174.7222, -36.782 ] } },
{ "type": "Feature", "properties": { "id": "a0l4a0000004F5Q", "Event": "Hirepool Equipment Hire Manukau 13/08/21", "Location": "301 Puhinui Road, Papatoetoe, Auckland 2025", "City": "Auckland", "Start": "2021-08-13T08:30:00Z", "End": "2021-08-13T08:45:00Z", "Advice": "Isolate at home for 14 days from date of last exposure. Test immediately, and on days 5 & 12 after last exposure. Call Healthline for what to do next.", "Added": "", "lat": -36.992263, "lon": 174.845963 }, "geometry": { "type": "Point", "coordinates": [ 174.845963, -36.992263 ] } },
{ "type": "Feature", "properties": { "id": "a0l4a0000004F5f", "Event": "Hoyts Cinemas Wairau Park 12/08/21", "Location": "15 Link Drive, Wairau Valley, Auckland 0627", "City": "Auckland", "Start": "2021-08-12T18:00:00Z", "End": "2021-08-12T20:30:00Z", "Advice": "Isolate at home for 14 days from date of last exposure. Test immediately, and on days 5 & 12 after last exposure. Call Healthline for what to do next.", "Added": "", "lat": -36.76562, "lon": 174.738534 }, "geometry": { "type": "Point", "coordinates": [ 174.738534, -36.76562 ] } },
{ "type": "Feature", "properties": { "id": "a0l4a0000004F4X", "Event": "Novi Lunch Bar 12/08/21", "Location": "25 Bowden Road, Mount Wellington, Auckland 1060", "City": "Auckland", "Start": "2021-08-12T13:45:00Z", "End": "2021-08-12T14:00:00Z", "Advice": "Isolate at home for 14 days from date of last exposure. Test immediately, and on days 5 & 12 after last exposure. Call Healthline for what to do next.", "Added": "", "lat": -36.917107, "lon": 174.850726 }, "geometry": { "type": "Point", "coordinates": [ 174.850726, -36.917107 ] } },
{ "type": "Feature", "properties": { "id": "a0l4a0000004F4S", "Event": "Foodcourt Westfield Albany 13/08/21", "Location": "219 Don McKinnon Drive, Albany, Auckland 0632", "City": "Auckland", "Start": "2021-08-13T17:45:00Z", "End": "2021-08-13T18:15:00Z", "Advice": "Isolate at home for 14 days from date of last exposure. Test immediately, and on days 5 & 12 after last exposure. Call Healthline for what to do next.", "Added": "", "lat": -36.726809, "lon": 174.705609 }, "geometry": { "type": "Point", "coordinates": [ 174.705609, -36.726809 ] } },
{ "type": "Feature", "properties": { "id": "a0l4a0000004F51", "Event": "Stirling Sports Westfield Albany  13/08/21", "Location": "219 Don McKinnon Drive, Albany, Auckland 0632", "City": "Auckland", "Start": "2021-08-13T17:00:00Z", "End": "2021-08-13T17:15:00Z", "Advice": "Isolate at home for 14 days from date of last exposure. Test immediately, and on days 5 & 12 after last exposure. Call Healthline for what to do next.", "Added": "", "lat": -36.726809, "lon": 174.705609 }, "geometry": { "type": "Point", "coordinates": [ 174.705609, -36.726809 ] } },
{ "type": "Feature", "properties": { "id": "a0l4a0000004F7q", "Event": "Unistrut Mt Wellington 10/08/21", "Location": "6 Arthur Brown Place, Mount Wellington, Auckland 1060", "City": "Auckland", "Start": "2021-08-10T10:00:00Z", "End": "2021-08-10T10:30:00Z", "Advice": "Isolate at home for 14 days from date of last exposure. Test immediately, and on days 5 & 12 after last exposure. Call Healthline for what to do next.", "Added": "", "lat": -36.916235, "lon": 174.844905 }, "geometry": { "type": "Point", "coordinates": [ 174.844905, -36.916235 ] } },
{ "type": "Feature", "properties": { "id": "a0l4a0000004F6J", "Event": "The Lula Inn Auckland CBD 07/08/21", "Location": "149 Quay Street, Auckland Central, Auckland 1010", "City": "Auckland", "Start": "2021-08-07T23:45:00Z", "End": "2021-08-08T00:30:00Z", "Advice": "Isolate at home for 14 days from date of last exposure. Test immediately, and on days 5 & 12 after last exposure. Call Healthline for what to do next.", "Added": "", "lat": -36.842188, "lon": 174.763232 }, "geometry": { "type": "Point", "coordinates": [ 174.763232, -36.842188 ] } },
{ "type": "Feature", "properties": { "id": "a0l4a0000004F7M", "Event": "J. A. Russell Ltd Mt Wellington 10/08/21", "Location": "Unit D/68 Carbine Road, Mount Wellington, Auckland 1062", "City": "Auckland", "Start": "2021-08-10T10:30:00Z", "End": "2021-08-10T10:51:00Z", "Advice": "Isolate at home for 14 days from date of last exposure. Test immediately, and on days 5 & 12 after last exposure. Call Healthline for what to do next.", "Added": "", "lat": -36.9163, "lon": 174.847 }, "geometry": { "type": "Point", "coordinates": [ 174.847, -36.9163 ] } },
{ "type": "Feature", "properties": { "id": "a0l4a0000004F7l", "Event": "Remuera Exchange Auckland 09/08/21", "Location": "2A Dilworth Avenue, Remuera, Auckland 1050", "City": "Auckland", "Start": "2021-08-09T06:30:00Z", "End": "2021-08-09T07:45:00Z", "Advice": "Isolate at home for 14 days from date of last exposure. Test immediately, and on days 5 & 12 after last exposure. Call Healthline for what to do next.", "Added": "", "lat": -36.875709, "lon": 174.785014 }, "geometry": { "type": "Point", "coordinates": [ 174.785014, -36.875709 ] } },
{ "type": "Feature", "properties": { "id": "a0l4a0000004F69", "Event": "Subway East Tamaki 12/08/21", "Location": "Cnr Springs Rd & Kerwyn Avenue, East Tamaki, Auckland 1125", "City": "Auckland", "Start": "2021-08-12T13:45:00Z", "End": "2021-08-12T14:00:00Z", "Advice": "Isolate at home for 14 days from date of last exposure. Test immediately, and on days 5 & 12 after last exposure. Call Healthline for what to do next.", "Added": "", "lat": -36.9488, "lon": 174.8922 }, "geometry": { "type": "Point", "coordinates": [ 174.8922, -36.9488 ] } },
{ "type": "Feature", "properties": { "id": "a0l4a0000004F8P", "Event": "One Stop Mechanical Mt Wellington 09/08/21", "Location": "15 Kalmia Street corner of, Sultan Street, Ellerslie, Auckland 1051", "City": "Auckland", "Start": "2021-08-09T08:00:00Z", "End": "2021-08-09T08:30:00Z", "Advice": "Isolate at home for 14 days from date of last exposure. Test immediately, and on days 5 & 12 after last exposure. Call Healthline for what to do next.", "Added": "", "lat": -36.8981, "lon": 174.8074 }, "geometry": { "type": "Point", "coordinates": [ 174.8074, -36.8981 ] } },
{ "type": "Feature", "properties": { "id": "a0l4a0000004F8U", "Event": "Passion Bakery Birkdale 17/08/21", "Location": "34 Birkdale Road, Birkdale, Auckland 0626", "City": "Auckland", "Start": "2021-08-17T08:30:00Z", "End": "2021-08-17T09:45:00Z", "Advice": "Isolate at home for 14 days from date of last exposure. Test immediately, and on days 5 & 12 after last exposure. Call Healthline for what to do next.", "Added": "", "lat": -36.805899, "lon": 174.704483 }, "geometry": { "type": "Point", "coordinates": [ 174.704483, -36.805899 ] } },
{ "type": "Feature", "properties": { "id": "a0l4a0000004F8A", "Event": "Brews Ponsonby 13/08/21", "Location": "250 Ponsonby Road, Ponsonby, Auckland 1011", "City": "Auckland", "Start": "2021-08-13T20:00:00Z", "End": "2021-08-13T20:15:00Z", "Advice": "Isolate at home for 14 days from date of last exposure. Test immediately, and on days 5 & 12 after last exposure. Call Healthline for what to do next.", "Added": "", "lat": -36.851426, "lon": 174.744534 }, "geometry": { "type": "Point", "coordinates": [ 174.744534, -36.851426 ] } },
{ "type": "Feature", "properties": { "id": "a0l4a0000004F8K", "Event": "Unistrut Mt Wellington 09/08/21", "Location": "6 Arthur Brown Place, Mount Wellington, Auckland 1060", "City": "Auckland", "Start": "2021-08-09T08:45:00Z", "End": "2021-08-09T10:15:00Z", "Advice": "Isolate at home for 14 days from date of last exposure. Test immediately, and on days 5 & 12 after last exposure. Call Healthline for what to do next.", "Added": "", "lat": -36.916235, "lon": 174.844905 }, "geometry": { "type": "Point", "coordinates": [ 174.844905, -36.916235 ] } },
{ "type": "Feature", "properties": { "id": "a0l4a0000004F98", "Event": "McDonalds New Lynn 14/08/21", "Location": "1 Memorial Drive, New Lynn, Auckland 0600", "City": "Auckland", "Start": "2021-08-14T23:00:00Z", "End": "2021-08-15T07:15:00Z", "Advice": "Isolate at home for 14 days from date of last exposure. Test immediately, and on days 5 & 12 after last exposure. Call Healthline for what to do next.", "Added": "", "lat": -36.908262, "lon": 174.68357 }, "geometry": { "type": "Point", "coordinates": [ 174.68357, -36.908262 ] } },
{ "type": "Feature", "properties": { "id": "a0l4a0000004F9I", "Event": "McDonalds New Lynn 13/08/21", "Location": "1 Memorial Drive, New Lynn, Auckland 0600", "City": "Auckland", "Start": "2021-08-13T23:00:00Z", "End": "2021-08-14T07:15:00Z", "Advice": "Isolate at home for 14 days from date of last exposure. Test immediately, and on days 5 & 12 after last exposure. Call Healthline for what to do next.", "Added": "22/08/2021 11:49", "lat": -36.908262, "lon": 174.68357 }, "geometry": { "type": "Point", "coordinates": [ 174.68357, -36.908262 ] } },
{ "type": "Feature", "properties": { "id": "a0l4a0000004F9h", "Event": "Countdown Botany Downs 17/08/2021", "Location": "Cnr Te Irirangi Drive &, Ti Rakau Drive, Botany Downs, Auckland 2023", "City": "Auckland", "Start": "2021-08-17T10:20:00Z", "End": "2021-08-17T10:30:00Z", "Advice": "Isolate at home for 14 days from date of last exposure. Test immediately, and on days 5 & 12 after last exposure. Call Healthline for what to do next.", "Added": "", "lat": -36.9299, "lon": 174.9111 }, "geometry": { "type": "Point", "coordinates": [ 174.9111, -36.9299 ] } },
{ "type": "Feature", "properties": { "id": "a0l4a0000004F9m", "Event": "KFC Botany Downs 17/08/2021", "Location": "452 Ti Rakau Drive, Botany Downs, Auckland 2013", "City": "Auckland", "Start": "2021-08-17T10:30:00Z", "End": "2021-08-17T10:40:00Z", "Advice": "Isolate at home for 14 days from date of last exposure. Test immediately, and on days 5 & 12 after last exposure. Call Healthline for what to do next.", "Added": "", "lat": -36.9295, "lon": 174.9078 }, "geometry": { "type": "Point", "coordinates": [ 174.9078, -36.9295 ] } },
{ "type": "Feature", "properties": { "id": "a0l4a0000004Gn8", "Event": "St Pierre's Sushi Ponsonby 16/08/2021", "Location": "314 Ponsonby Road, Ponsonby, Auckland 1011", "City": "Auckland", "Start": "2021-08-16T18:30:00Z", "End": "2021-08-16T19:00:00Z", "Advice": "Isolate at home for 14 days from date of last exposure. Test immediately, and on days 5 & 12 after last exposure. Call Healthline for what to do next.", "Added": "2021-08-22 19:15:42", "lat": -36.848148, "lon": 174.743704 }, "geometry": { "type": "Point", "coordinates": [ 174.743704, -36.848148 ] } },
{ "type": "Feature", "properties": { "id": "a0l4a0000004EOW", "Event": "Star and Garter Hotel Coromandel 13/08/21", "Location": "5 Kapanga Road, Coromandel 3506", "City": "Coromandel", "Start": "2021-08-13T18:39:00Z", "End": "2021-08-13T19:40:00Z", "Advice": "Isolate at home for 14 days from date of last exposure. Test immediately, and on days 5 & 12 after last exposure. Call Healthline for what to do next.", "Added": "", "lat": -36.760007, "lon": 175.497238 }, "geometry": { "type": "Point", "coordinates": [ 175.497238, -36.760007 ] } },
{ "type": "Feature", "properties": { "id": "a0l4a0000004EOX", "Event": "Umu Cafe Coromandel 13/08/21", "Location": "22 Wharf Road, Coromandel 3506", "City": "Coromandel", "Start": "2021-08-13T19:40:00Z", "End": "2021-08-13T20:30:00Z", "Advice": "Isolate at home for 14 days from date of last exposure. Test immediately, and on days 5 & 12 after last exposure. Call Healthline for what to do next.", "Added": "", "lat": -36.760098, "lon": 175.497078 }, "geometry": { "type": "Point", "coordinates": [ 175.497078, -36.760098 ] } },
{ "type": "Feature", "properties": { "id": "a0l4a0000004EPA", "Event": "Jaks Cafe & Bar Coromandel 14/08/21", "Location": "104 Kapanga Road, Coromandel 3506", "City": "Coromandel", "Start": "2021-08-14T10:50:00Z", "End": "2021-08-14T11:30:00Z", "Advice": "Isolate at home for 14 days from date of last exposure. Test immediately, and on days 5 & 12 after last exposure. Call Healthline for what to do next.", "Added": "", "lat": -36.759307, "lon": 175.498072 }, "geometry": { "type": "Point", "coordinates": [ 175.498072, -36.759307 ] } },
{ "type": "Feature", "properties": { "id": "a0l4a0000004EPP", "Event": "Devonport pharmacy 16/08/21", "Location": "33 Victoria Road, Devonport, Auckland 0624", "City": "Auckland", "Start": "2021-08-16T14:15:00Z", "End": "2021-08-16T14:30:00Z", "Advice": "Stay at home, test immediately and on or around day 5 after last exposure and continue to stay at home until you receive a negative day 5 test result. Call Healthline for what to do next.", "Added": "", "lat": -36.831074, "lon": 174.79719 }, "geometry": { "type": "Point", "coordinates": [ 174.79719, -36.831074 ] } },
{ "type": "Feature", "properties": { "id": "a0l4a0000004EPK", "Event": "Hereford n A Pickle Coromandel 14/08/21", "Location": "2318 Colville Road, RD 4, Coromandel 3584", "City": "Coromandel", "Start": "2021-08-14T13:25:00Z", "End": "2021-08-14T14:15:00Z", "Advice": "Isolate at home for 14 days from date of last exposure. Test immediately, and on days 5 & 12 after last exposure. Call Healthline for what to do next.", "Added": "", "lat": -36.633733, "lon": 175.476413 }, "geometry": { "type": "Point", "coordinates": [ 175.476413, -36.633733 ] } },
{ "type": "Feature", "properties": { "id": "a0l4a0000004EPZ", "Event": "Star and Garter Hotel Coromandel 14/08/21", "Location": "5 Kapanga Road, Coromandel 3506", "City": "Coromandel", "Start": "2021-08-14T19:11:00Z", "End": "2021-08-14T21:00:00Z", "Advice": "Isolate at home for 14 days from date of last exposure. Test immediately, and on days 5 & 12 after last exposure. Call Healthline for what to do next.", "Added": "", "lat": -36.760007, "lon": 175.497238 }, "geometry": { "type": "Point", "coordinates": [ 175.497238, -36.760007 ] } },
{ "type": "Feature", "properties": { "id": "a0l4a0000004ERG", "Event": "BP Gas Station Coromandel 14/08/21", "Location": "50 Tiki Road, Coromandel 3056", "City": "Coromandel", "Start": "2021-08-14T09:30:00Z", "End": "2021-08-14T09:40:00Z", "Advice": "Isolate at home for 14 days from date of last exposure. Test immediately, and on days 5 & 12 after last exposure. Call Healthline for what to do next.", "Added": "", "lat": -36.7606, "lon": 175.4976 }, "geometry": { "type": "Point", "coordinates": [ 175.4976, -36.7606 ] } },
{ "type": "Feature", "properties": { "id": "a0l4a0000004ERa", "Event": "Driving Creek Railway Tours Coromandel 14/08/21", "Location": "380 Driving Creek Road, Coromandel 3506", "City": "Coromandel", "Start": "2021-08-14T10:30:00Z", "End": "2021-08-14T10:50:00Z", "Advice": "Isolate at home for 14 days from date of last exposure. Test immediately, and on days 5 & 12 after last exposure. Call Healthline for what to do next.", "Added": "", "lat": -36.737118, "lon": 175.50335 }, "geometry": { "type": "Point", "coordinates": [ 175.50335, -36.737118 ] } },
{ "type": "Feature", "properties": { "id": "a0l4a0000004ERu", "Event": "Driving Creek Railway Tours Coromandel 14/08/21", "Location": "380 Driving Creek Road, Coromandel 3506", "City": "Coromandel", "Start": "2021-08-14T11:20:00Z", "End": "2021-08-14T13:00:00Z", "Advice": "Isolate at home for 14 days from date of last exposure. Test immediately, and on days 5 & 12 after last exposure. Call Healthline for what to do next.", "Added": "", "lat": -36.737118, "lon": 175.50335 }, "geometry": { "type": "Point", "coordinates": [ 175.50335, -36.737118 ] } },
{ "type": "Feature", "properties": { "id": "a0l4a0000004Egk", "Event": "Sweat Shop Brew Kitchen 13/08/2021", "Location": "7 Sale Street, Auckland Central, Auckland 1010", "City": "Auckland", "Start": "2021-08-13T21:00:00Z", "End": "2021-08-14T00:00:00Z", "Advice": "Isolate at home for 14 days from date of last exposure. Test immediately, and on days 5 & 12 after last exposure. Call Healthline for what to do next.", "Added": "", "lat": -36.849065, "lon": 174.756878 }, "geometry": { "type": "Point", "coordinates": [ 174.756878, -36.849065 ] } },
{ "type": "Feature", "properties": { "id": "a0l4a0000004EyP", "Event": "HYPE DC Albany Mall 13/08/21", "Location": "Shop 254/219 Don McKinnon Drive, Albany, Auckland 0632", "City": "Auckland", "Start": "2021-08-13T17:22:00Z", "End": "2021-08-13T17:29:00Z", "Advice": "Isolate at home for 14 days from date of last exposure. Test immediately, and on days 5 & 12 after last exposure. Call Healthline for what to do next.", "Added": "", "lat": -36.7286, "lon": 174.7081 }, "geometry": { "type": "Point", "coordinates": [ 174.7081, -36.7286 ] } },
{ "type": "Feature", "properties": { "id": "a0l4a0000004Exw", "Event": "Mexico Britomart Auckland CBD 09/08/2021", "Location": "23 Britomart Place, Auckland Central, Auckland 1010", "City": "Auckland", "Start": "2021-08-09T17:55:00Z", "End": "2021-08-09T20:15:00Z", "Advice": "Isolate at home for 14 days from date of last exposure. Test immediately, and on days 5 & 12 after last exposure. Call Healthline for what to do next.", "Added": "22/08/2021 11:49", "lat": -36.845228, "lon": 174.770225 }, "geometry": { "type": "Point", "coordinates": [ 174.770225, -36.845228 ] } },
{ "type": "Feature", "properties": { "id": "a0l4a0000004Ez3", "Event": "Matsu Sushi Bar Westfield Albany Mall 13/08/2021", "Location": "219 Don McKinnon Drive, Albany, Auckland 0632", "City": "Auckland", "Start": "2021-08-13T17:45:00Z", "End": "2021-08-13T17:50:00Z", "Advice": "Isolate at home for 14 days from date of last exposure. Test immediately, and on days 5 & 12 after last exposure. Call Healthline for what to do next.", "Added": "", "lat": -36.7268, "lon": 174.7056 }, "geometry": { "type": "Point", "coordinates": [ 174.7056, -36.7268 ] } },
{ "type": "Feature", "properties": { "id": "a0l4a0000004F0B", "Event": "Liquor King Ponsonby 13/08/2021", "Location": "254 Ponsonby Road, Ponsonby, Auckland 1011", "City": "Auckland", "Start": "2021-08-13T18:15:00Z", "End": "2021-08-13T18:30:00Z", "Advice": "Isolate at home for 14 days from date of last exposure. Test immediately, and on days 5 & 12 after last exposure. Call Healthline for what to do next.", "Added": "", "lat": -36.850994, "lon": 174.7444 }, "geometry": { "type": "Point", "coordinates": [ 174.7444, -36.850994 ] } },
{ "type": "Feature", "properties": { "id": "a0l4a0000004F35", "Event": "Z Harris Road Service Station East Tamaki 16/08/21", "Location": "142 Harris Road, East Tamaki, Auckland 2013", "City": "Auckland", "Start": "2021-08-16T12:00:00Z", "End": "2021-08-16T12:10:00Z", "Advice": "Isolate at home for 14 days from date of last exposure. Test immediately, and on days 5 & 12 after last exposure. Call Healthline for what to do next.", "Added": "", "lat": -36.929732, "lon": 174.896951 }, "geometry": { "type": "Point", "coordinates": [ 174.896951, -36.929732 ] } },
{ "type": "Feature", "properties": { "id": "a0l4a0000004F3P", "Event": "Remuera Exchange Auckland 16/08/21", "Location": "2A Dilworth Avenue, Remuera, Auckland 1050", "City": "Auckland", "Start": "2021-08-16T06:40:00Z", "End": "2021-08-16T07:17:00Z", "Advice": "Isolate at home for 14 days from date of last exposure. Test immediately, and on days 5 & 12 after last exposure. Call Healthline for what to do next.", "Added": "", "lat": -36.875709, "lon": 174.785014 }, "geometry": { "type": "Point", "coordinates": [ 174.785014, -36.875709 ] } },
{ "type": "Feature", "properties": { "id": "a0l4a0000004F3Z", "Event": "KFC Takapuna 15/08/21", "Location": "1 Taharoto Road, Takapuna, Auckland 0622", "City": "Auckland", "Start": "2021-08-15T17:50:00Z", "End": "2021-08-15T18:30:00Z", "Advice": "Isolate at home for 14 days from date of last exposure. Test immediately, and on days 5 & 12 after last exposure. Call Healthline for what to do next.", "Added": "", "lat": -36.789622, "lon": 174.761757 }, "geometry": { "type": "Point", "coordinates": [ 174.761757, -36.789622 ] } },
{ "type": "Feature", "properties": { "id": "a0l4a0000004F3e", "Event": "Movie Monterey Takapuna 15/08/21", "Location": "32 Anzac Street, Takapuna, Auckland 0622", "City": "Auckland", "Start": "2021-08-15T15:36:00Z", "End": "2021-08-15T17:45:00Z", "Advice": "Isolate at home for 14 days from date of last exposure. Test immediately, and on days 5 & 12 after last exposure. Call Healthline for what to do next.", "Added": "", "lat": -36.786505, "lon": 174.771924 }, "geometry": { "type": "Point", "coordinates": [ 174.771924, -36.786505 ] } },
{ "type": "Feature", "properties": { "id": "a0l4a0000004F3y", "Event": "Domino's Pizza Beach Haven 13/08/21", "Location": "104 Beach Haven Road, Beach Haven, Auckland 0626", "City": "Auckland", "Start": "2021-08-13T19:45:00Z", "End": "2021-08-13T20:00:00Z", "Advice": "Isolate at home for 14 days from date of last exposure. Test immediately, and on days 5 & 12 after last exposure. Call Healthline for what to do next.", "Added": "", "lat": -36.791364, "lon": 174.687561 }, "geometry": { "type": "Point", "coordinates": [ 174.687561, -36.791364 ] } },
